aspect,np,review視聴覚の魅力,1,ゲームのスタイルが気に入った。ゲームの見た目と雰囲気が気に入った。私はゲームの美学を高く評価した。
視聴覚の魅力,1,美しい世界観、美しいBGMにより、雰囲気は最高に良い
視聴覚の魅力,1,音楽はオートマタ以上に神。エンディングでもオープニングでも無いのに歌が流れるって点では、スターオーシャン3でもミーシャの歌をずっと聞いてたっけなぁ。
視聴覚の魅力,1,クオリティは高くギリギリオススメは出来るかなという感じ
視聴覚の魅力,-1,11年前のゲームの古臭さが抜け切れてない
視聴覚の魅力,1,音楽が単独でもすごくいいです。シーンごとにすごくあっていてよかった。
視聴覚の魅力,1,音楽・ストーリーはもちろんのこと、アクションも爽快で非常に楽しめました。
視聴覚の魅力,-1,ビジュアルノベルとしてはオススメできるが、ゲームとしてはオススメできない
視聴覚の魅力,1,BGMは個人的には悪くないです
視聴覚の魅力,-1,ただ10年以上前のゲームのリメイクなのでアクション面やグラフィック、ＵＩ等はどうしても今の基準のゲームと比べるとやや見劣りする
視聴覚の魅力,1,グラフィックの向上＆FPS向上＆システム色いろ変更された
視聴覚の魅力,1,素晴らしいリメイクでした
視聴覚の魅力,1,音楽の雰囲気はいいね
視聴覚の魅力,1,グラフィックやサウンドが良いと感じた
視聴覚の魅力,1,唸らせるシナリオ展開に加えて、それら各シーンを彩る楽曲も素晴らしいものが多いです。情景に合わせて、時には寄り添うように、時には鼓舞するように、映画音楽のように盛り上げてくれます。初代より顔も声も表情豊かになって、表現されきっていなかった機微まで感じられます。
視聴覚の魅力,1,音楽をとっても、グラフィックをとっても、もちろんストーリーも。フルボイスで楽しむことができるので、感情移入のレベルが違います。
視聴覚の魅力,-1,カイネやニーア、ヨナ、デポル＆ポポルの顔が奇麗になったのですが個人的には㎰3版のほうが好みです。あの薄暗い神秘さが好きだった人には少し受け入れがたいのではないかと感じました。全体的に白すぎる。㎰3版のもう少し暗めのダークな感じがあってた気がします。
視聴覚の魅力,1,岡部啓一らの手がける音楽は極めて良い。感情をゆさぶるユニークで力強い音楽に対して、他のゲームシステムが追い付いていない
視聴覚の魅力,1,レプリカントの音楽とストーリーは最高だなって思う
視聴覚の魅力,1,特に音楽に関してはautomata同様素晴らしいと思います。
視聴覚の魅力,1,世界観、ストーリー、音楽、マップ、グラフィック、キャラクターデザイン、ボイス、モーションが良いと感じた
視聴覚の魅力,-1,キャラクター造型が非常に雑で発言に臭さを感じた。
視聴覚の魅力,1,曲は神。ストーリーも非常に面白かった。特にEエンドルートはバチクソに面白かった。キャラデザも相変わらず高水準で仕上げてくる。
視聴覚の魅力,1,ストーリーはもちろんアクションも秀逸。
視聴覚の魅力,1,ニーアシリーズ特有のシナリオ､音楽､アクションの良さはしっかり健在です
視聴覚の魅力,1,主要キャラ全員、美男美女度が大幅アップ。イベントシーンでの表情がとてもイイです。フルボイスです。音楽は世界の岡部です。イベントシーンで入ってくるBGMはもはや凶器です。
視聴覚の魅力,1,美しいBGMが気に入った
視聴覚の魅力,1,音楽に関してはサントラが欲しいなと思えるくらいとても素晴らしいです。全体的な雰囲気は良いのにもったいないと感じる。
視聴覚の魅力,1,グラフィックの向上、リメイクBGM、追加のシナリオがあった
視聴覚の魅力,1, tons of additional stories and elements compared to the original version (+ full voice)
視聴覚の魅力,-1,画像の解像度は1920×1080が推奨されているのですが、それを最低値にしなければ、まともに動きません。
視聴覚の魅力,-1,妹ヨナのロリ萌え声が気色悪くて大いに興が削がれた。
視聴覚の魅力,1,BGMよし、ストーリーよし
視聴覚の魅力,1,キャラも物語も音楽も全部神。
視聴覚の魅力,1,音楽もストーリーもアクションも最高！！！
視聴覚の魅力,1,ストーリー、世界観が完璧だった
視聴覚の魅力,1,ヨナが可愛い
視聴覚の魅力,-1,美しくはなっているが今の水準でみると全体的に何世代か前のクオリティ
視聴覚の魅力,1,ストーリーも音楽も神過ぎてる、BGMがとにかく神すぎる
視聴覚の魅力,1,ストーリー、キャラクター、アクション、世界観、やりこみが神過ぎる
視聴覚の魅力,0,音楽・キャラは普通かなという感じ
視聴覚の魅力,1,アクションよりもストーリーと絵の美しさと音楽がキモなので個人的には十分すぎると思います。
視聴覚の魅力,1,フルボイスで出力されるそれぞれの登場人物の感情を是非感じてください。
視聴覚の魅力,1,何度もスクショを撮ろうと思える美しい作品。
視聴覚の魅力,1,すごくきれいになっててびっくり。
視聴覚の魅力,1,ピーターの声が聴きたかったためにこのゲーム買ったまであった
視聴覚の魅力,1,good graphic
視聴覚の魅力,1,すごく良い
視聴覚の魅力,-1,選択・決定音が静岡なんよ
視聴覚の魅力,1,音楽、雰囲気◎。
視聴覚の魅力,1,とっても、かっこいいです
遊ぶ意義,1,壮大なスケール、世界観、楽曲が素晴らしく、糞な要素を忘れてしまうほどよくできていると感じた
遊ぶ意義,1,ストーリーがすごく面白くなまりすので買って良かったと思いました。ストーリーはとても切なく何周しても同じシーンでポロポロ泣いてしまいました。
遊ぶ意義,1,ゲームとして面白いかどうかではなく、プレイヤーの記憶に残り続ける作品
遊ぶ意義,1,ストーリーが良いと思う。モブキャラに感情移入するほどのストーリーです。武器をすべて集めてみると楽しさが倍増します
遊ぶ意義,1,ストーリーに関しては圧巻の出来だと思います！何周もする性質上、一周目ではよくわからなかった事柄が紐解かれていく快感を味わうことが出来ます。俗に言う伏線回収ってやつですね。
遊ぶ意義,0,"全てのエンディングを観るためには、ストーリーの周回が必要となり、かなりの時間と労力が必要。全てのエンディングを観たものだけに得られるものがある！"
遊ぶ意義,1,ゲームを体感するだけでもかなりの価値があります
遊ぶ意義,1,シナリオと音楽が最高で、感情移入させる上手い進行により「もっと浸っていたい」と思える作品であると感じた。設定が練られていて素晴らしい。
遊ぶ意義,0,ゲームはやりつくしたので、これからストーリーを補完する内容を調べてより楽しめたらと思います
遊ぶ意義,1,"NieRファンなら最後までやってもめちゃくちゃ楽しめる"
遊ぶ意義,1,"このゲームをプレイすることは私にとって価値があった"
遊ぶ意義,1,ニーアの世界観を補強するという意味ではプレイして良かったと思っています
遊ぶ意義,1,ストーリーとのつながりがあり、他の作品をプレイすることで理解が深まると感じている。
遊ぶ意義,1,"全実績解除でのレビューです。NieR Automata が好きでPS4,Steamでもプレイした私的には本作オススメできます。ストーリー上、ガラッと変わるのはラストのみ。その我慢に見合ったお釣りが返ってくると思いますよ。面白いので是非！！"
遊ぶ意義,1,秀逸なストーリーと世界観を体験するだけでも、このゲームをプレイする価値はある
遊ぶ意義,1,シナリオと音楽が好きであれば総合的な面白さは文句無しのポジティブ評価
遊ぶ意義,1,最高以外の言葉が見つからないほど、当時の思い出に浸りながらのプレイは有意義だったと感じている。
遊ぶ意義,1,"プレイ時間50時間でなんとかトロフィーコンプ出来ました。PS3版からレプリカントの世界観がかなり好きだったので今作もかなり楽しめました。とくに追加エンドのカイネのセリフやトロコンした瞬間の本当にすべてやり切ってしまったという喪失感に精神を揺さぶられまくりました。ですので、追加エンドの最終でトロコンするように進めることをお勧めします。"
遊ぶ意義,1,ゲームをプレイすることは私にとって有意義だった。このゲームは私にとって意味のあるものだと感じた。このゲームをプレイすることは私にとって価値があった。
遊ぶ意義,1,"このゲームは私にとって意味のあるものだと感じた。NieRの世界観を理解するにはプレイする必要がある作品です。物語性は:Automataすら凌ぎます。考査するのがまた楽しい。  "
遊ぶ意義,1,"おすすめで、やりごたえがあり面白かった"
遊ぶ意義,1,シナリオだけで買う価値あります
遊ぶ意義,1,"ゲーム内演出含めてセンスの塊です。これらを純粋に楽しむのが一番良い遊び方だと思います。"
遊ぶ意義,1,つながりがすごい
遊ぶ意義,1,ゲームはキャラクターに感情移入できるのが大きいと感じます
遊ぶ意義,1,人々の生活が見れて楽しいです。小さなタスクをこなしていくことで私の中でモブがモブとして終わるらずに一人のキャラクターとして立たせることができます。
遊ぶ意義,1,物語と音楽がとても良い
遊ぶ意義,1,ゲームは自信をもってお勧めできる面白いゲームだと思う。こちらにのめりこんでしまうぐらいには熱中できるゲームなので、迷っている人はぜひ遊んでもらえればと思う。
遊ぶ意義,1,リメイクの追加要素はやっていてわくわくしたし、ぜひ何も知らない人は遊んでほしい
遊ぶ意義,1,人間的感情に問いかけるような要素がテーマアップされており、主人公たちの信念を頼りに生きているという印象を受けることで、大切なものとの共鳴が感じられる。
遊ぶ意義,1,良い作品だと感じ、ストーリーに感動した
遊ぶ意義,1,ストーリーが良かった。こんな鬱展開で悲しい話なのに、どこか救いを感じさせてしまうのはなんででしょう？とても美しいストーリーです。やっぱり、私はなによりストーリーが好きです。すべてを語らず、想像の余地と余韻を残す終わり方。しばらく小説版を読みながら、世界観にどっぷり浸かります。
遊ぶ意義,1,"『NieR Replicantを遊びたいんだ！！』というユーザーは必ず満足できる。この形のゲームで良かったと思える。  "
遊ぶ意義,1,特別な雰囲気と世界観が魅力
遊ぶ意義,1,シリーズ間の繋がりを感じる部分がありました
遊ぶ意義,1,自分が興味を持っているストーリーの繋がりを知ることができ、面白かったと感じた
遊ぶ意義,1,価値観がひっくり返ります。正義とは何か、何が正しいのか、ぜひ自分の中で探しながらプレイしてみてください。
遊ぶ意義,1,オートマタに出てきたキャラや場所が登場するたびに感動します。レプリカント面白いと思ったならオートマタもぜひやるべきです！
遊ぶ意義,1,ゲームを通じてゲシュタルトの世界観を深く理解したいという気持ちがあった
遊ぶ意義,1,"ニア・レプリカントの物語は、私たちは何年もの間あなたと共鳴する旅に出ます。真の脅威と比較して、早い段階で取り組む問題の多くは、ストーリーの多くのポイントで大規模なトーンの変化につながりますが、違いを生み、世界を救うという希望はまだあります。"
遊ぶ意義,-1,"ニーアとして出た一作目の感動は次作でも超えられないと感じた"
遊ぶ意義,-1,遊ぶ意義がないと感じた
遊ぶ意義,1,やっててよかったと感じた
遊ぶ意義,1,ストーリーを頑張って理解するというプレイ方法が良いと思います。
遊ぶ意義,1,神ゲーであることは間違いありません。それだけは改めてお伝えします。
遊ぶ意義,1,プレイする価値があります。Eエンドを見ることが出来るだけでも価値のある作品です。
遊ぶ意義,1,己の大切な何かの為に戦い続ける登場人物に感じるものがあります。
遊ぶ意義,1,"有意義だった"
遊ぶ意義,1,このゲームは私にとって意味のあるものだと感じた。このゲームをプレイすることは私にとって価値があった。
遊ぶ意義,1,ゲームをプレイすることは私にとって有意義だった。このゲームは私にとって意味のあるものだと感じた。このゲームをプレイすることは私にとって価値があった。
遊ぶ意義,1,これ以上のストーリー、世界観において完璧なゲームはそうそうない
遊ぶ意義,1,オートマタが面白かった人はそれを体験するためだけに買ってもいいと思う
遊ぶ意義,1,このゲームのシナリオは味わうべきです
遊ぶ意義,1,自らのリアルと重ねて考えさせられたり、プレイした他者の意見や感想を聞いてみたくなる作品
没入感,1,感情移入のレベルが違います
没入感,1,物語の没頭できる素晴らしい作品。
没入感,1,プレイ中、物語に強く引き込まれ、深く考えさせられる感覚があった。
没入感,1,"プレイして30分ぐらいで涙出そうになるぐらい懐かしい"
没入感,0,気がついたら時間が経ってたとかないです
没入感,1,敵をかわしたときにスローになり、敵の背後に回ったり、青年期からの大剣での攻撃モーションが美しかったりとても魅了されました
没入感,1,おかげで没入感が高かった
没入感,1,おもわず引き込まれます
没入感,1,エンディング分岐のためにストーリーの周回が必要だが追加シーンやイベントがありそこまで退屈せずに進めることができた。魔法がいちいちかっこよすぎる。
没入感,1,少しずつ、世界に入り込めている気がする
没入感,-1,プレイ中は周囲の状況に気付かなくなった
没入感,1,"私は最近の記憶では、ニーア・レプリカントのように爆弾の暴露を落としたゲームはありません。このゲームには、文字通り顎が下がる箇所が多く、考えをまとめるのに少し時間がかかりました。"
没入感,1,"歌声が聞こえてくる演出は当時斬新で、小一時間彼女の脇に立って聞き惚れてたが、今も同じだった"
没入感,-1,没入感が得られなかった
没入感,1,初代、Automataプレイ済でもしっかり引き込まれました
没入感,1,感情移入のレベルが違います
没入感,1,フルボイスで出力されるそれぞれの登場人物の感情を是非感じてください
成長感の得やすさ,1,いままで動画勢だったので、初見プレイなのでこれからじっくりやり込むのが楽しみです！！
成長感の得やすさ,-1,成長システムに面白みはありません
成長感の得やすさ,1,全実績解除については武器強化や月光草など時間がかかるものもあったがまぁやりこみ要素だし良いと思う。
成長感の得やすさ,1,レベルや所持品が引き継がれるので1周目で苦戦したボスを軽々攻略できるのも爽快感があってよかった。プレイ時間のうち３分の１は武器強化のための素材集めである。
成長感の得やすさ,1,私はこのゲームをうまくプレイできると感じた
成長感の得やすさ,0,全搓一遍基本上也就记住了
成長感の得やすさ,1,自分は難易度ハードでやったほうがやりごたえがあって面白い
成長感の得やすさ,0,操作としてのアクション難易度はそこまで高くはないように感じました
成長感の得やすさ,1,トロコンまで走れました！
好奇心への刺激,1,ニーアオートマタで出てくる伏線の意味やワードの意味を調べたい人向け
好奇心への刺激,1,二週目以降で明らかとなる自分たちがマモノと呼んで退治していた者たちの正体、そしてあるエンディングでゲームのキャッチコピーが二つの意味を持っていたことを知ることとなる仕掛け
好奇心への刺激,1,"全てのエンディングを観てほしい。プレイした後に、NieR:Automataをプレイすることを強く勧めます。"
好奇心への刺激,0,ゲームがどのように進化したかを調べたかった
好奇心への刺激,1,"Automataで世界観が気に入った？ならReplicantもやろう"
好奇心への刺激,1,"こんなシーンあったっけ？とかなんだこの敵！とか当時を思い出しながらプレイするのが本当に楽しいです。"
好奇心への刺激,1,どのようにストーリーが進行するのかや、関連作品についての興味が喚起されている。
好奇心への刺激,1,ストーリーは全部見てみたいと思える作品である
好奇心への刺激,1,ニーアオートマタをプレイしてからずっと気になってた今作
好奇心への刺激,1,"私はゲームがどのように進化したかを調べたかった。この話が:Automataにどう繋がっていったのか考査するのがまた楽しい。  "
好奇心への刺激,1,今作をプレイしてロード中に再生される資料っぽい画像とかに興味がある
好奇心への刺激,1,情報を鵜呑みにして、砂漠の地下に何かあると踏んで流砂が落ち込む先へ飛び降りるほどに遊び尽くした
好奇心への刺激,0,"公式サイトにしか載ってないキャラクター情報がある"
好奇心への刺激,1,オートマタはまだクリアしてないけど絶対クリアする！レプリカントのガイドブック楽しみに待ってる！
好奇心への刺激,0,ストーリーは今のところ謎ばかり。まだ全体の5％くらいしか世界見えてないんじゃないかと思います。
好奇心への刺激,0,ゲームシステムは賛否両論かもですが
好奇心への刺激,-1,必要数を集めようと思ったら2，3時間ひたすらに同じコースを最適化しつつ、レアアイテム採集マラソンをする必要があるのが複数存在するのは何とかして欲しかった
好奇心への刺激,1,ストーリーの分岐に興味を持ち、進めたい気持ちがあった
好奇心への刺激,1,Replicantクリア後、気になってデポポポ登場シーンも見返しましたが、新たな発見と感動がありました。AutomataからNierシリーズをやった方はReplicantもやることをおススメします。
好奇心への刺激,1,"すべての設定を知ってから見ると描写の穴も違和感なく遊べる。何度も周回プレイすることに意味がある設定だったので、これでいいんだと今なら思える。  "
好奇心への刺激,-1,ネットで調べずにゲームすることをお勧め
好奇心への刺激,-1,ストーリーは1周では絶対に理解できないし、全周回を終えたとしても非常にややこしい
好奇心への刺激,0,ゲームがどのように進化したかを調べたかった
好奇心への刺激,0,どのようにして繋がったかや、フィールドの元々の場所を見たかった
好奇心への刺激,1,考察サイトを見て世界観を学ぶとグッと面白さが上がると思います。
好奇心への刺激,1,この世界を深く理解してみたいという気持ちになった
好奇心への刺激,-1,ゲーム背景や設定はよく練られていると思いますがゲームをプレイするだけだと説明が少ないためにほとんど理解できず消化不良に陥りました
好奇心への刺激,1,あらゆる伏線を探るだけでも楽しい。謎が深まった
好奇心への刺激,1,2週クリアを前提に作られているため、2週目限定のイベントが多いことに興味を持った
好奇心への刺激,1,NieR Automataを未プレイの皆様はどうぞそちらもプレイして彼を救って差し上げてください。
好奇心への刺激,-1,ストーリーがよくわからなかったので、wikiを読んである程度理解しました。
好奇心への刺激,-1,何でカイネが下着姿なのか分からんままだ
好奇心への刺激,1,設定資料集『GRIMOIRE NieR』を読むともっと楽しめる
好奇心への刺激,1,"興味が湧いた"
好奇心への刺激,1,このタイトルは気になっていた
好奇心への刺激,1,面白そう
好奇心への刺激,1,これからオートマタやります
好奇心への刺激,1,オートマタやってからレプリカントやると楽しめます
好奇心への刺激,1,ストーリーの謎を考察して、ネットで調べてみる程度のことができる方にはとてもお勧めします
好奇心への刺激,0,Automataの時はどうだったっけ？？
好奇心への刺激,1,ピーターの声が聴きたかったためにこのゲーム買ったまであった
好奇心への刺激,1,新しい作品をプレイしたい
自由度,1,基本的にこう戦うべきみたいなものが無いので自由度は高い
自由度,1,キーバインド設定を多少弄れば普通にプレイできました
自由度,1,自分のやり方で自由にゲームをプレイできた
自由度,-1,一周目後半でやっと申し訳程度のワープ機能（船）ができたこと。少年期の移動は非常に大変でした。
自由度,1,バフやデバフを各攻撃に自由に振り分けられたのも幅があって嬉しい
自由度,-1,"選んだ選択肢でエンドが変わる系なのだが、3,4週目で同じことの繰り返しで正直飽きる"
自由度,1,選択によるストーリーの分岐を感じた
自由度,1,この世界に住んでいる感じは出るので、ゲームとしては嫌な要素だが作品としては好きな要素。
自由度,-1,一度通り過ぎると同じセーブデータで達成率100%できなくなるのが悲しかった
自由度,1,基本的にこう戦うべきみたいなものが無いので自由度は高い
自由度,1,動かし易い感じがした
自由度,1,ダメだ、めんどくさいなどとと思ったらいつでもEASYに変えられる優しい仕組みになっています
