aspect,np,review
操作のしやすさ,-1,アクションは少し難点というか、理解するのに少し時間がいるかなと思います。基本的にこう戦うべきみたいなものが無いので自由度は高いのですがアクションが苦手な人は序盤が少し壁かなと思います。
操作のしやすさ,-1,ゲームシステムは粗削りではっきり言って糞。ニーアオートマタをプレイした後、このゲームをプレイするととても不便に感じると思う。ストレスが溜まる事間違いなし。
操作のしやすさ,1,操作性は各段によくなっていますが、美しいキャラクター達・世界観や物語、音楽を体感するだけでもかなりの価値があります。
操作のしやすさ,-1,このシステムは問題が多いと思います。ドロップなので敵を倒すコツなどが敵を倒した後に表示されるというチュートリアルとして本末転倒なものになっています。
操作のしやすさ,1,操作似てるのでめちゃくちゃ入りやすいです
操作のしやすさ,0,操作性は普通。
操作のしやすさ,-1,コントローラーが一切反応してくれなかったりして、少々苛々する事もあったですが、Big Pictureからコントローラーオプションで、Steam Inputを強制OFFにしてやることによって遊べるようになりました。難易度の適切さ:-1 進捗の明確さ:-1 目的の明確さ:-1 視聴覚の魅力:綺麗な映像でNieR Replicantが遊べるという評価があった。
操作のしやすさ,-1,操作性、戦闘アクションの爽快さ、素材の集めやすさ、移動の利便性は劣る
操作のしやすさ,1,アクションとしてはソウルシリーズやモンハンのような重い操作感や後隙が少なく、スルスルと軽く動くので動かしていてストレスがない。
操作のしやすさ,1,"移動しながら魔法のチャージが可能にそれ以外にも敵の背後に回るようにクルッと自動で回避してくれたり微妙に戦闘周りが改善されています。"
操作のしやすさ,1,やりごたえあって面白かったですし、キャラも立ってて愛着を持てました。automataのような謎の移動を強いられないので、ストレスは少ない。replicantはキーバインド設定を多少弄れば普通にプレイできました。ポッドと違って自律攻撃してくれないので指が攣る。走りキーを1度押し、再度押しで解除の形式もアリにしていただきたかった。それか歩く方をキー入力必須にしてほしい。
操作のしやすさ,-1,戦闘においてはアクションは軽快で滑らかな動きだが、敵の攻撃パターンが余りにも単調で作業感が強い
操作のしやすさ,1,視点移動はマウスをいちいち少しずつ動かす必要がありますが、魔法攻撃がオートエイムなのでそんなに不便ではありません。戦闘は敵に焦点を合わせ、魔法攻撃が当たると敵の体勢がくずれるので、近接してマウスクリックを適当に乱打。軽量剣ならShiftで回避すると勝手に相手の後ろに回り込むので、ボコるだけです。釣りはコントローラーがないと厳しいです。魚がかかるとコントローラーが振動するので、すかさず竿を手前に引く。魚の体力が削れている時は体力ゲージが振動するので、対角方向に引っ張り続ける。引っ張るのは　ＷＡＳＤ（Ｓは常に押しっぱなし）の方が簡単です。
操作のしやすさ,-1,一切反応せず先に進めない
操作のしやすさ,1,多少ギャップを感じるかもしれませんが、そこを許容できれば十分楽しめると思います
操作のしやすさ,1,戦闘は緩急のメリハリがついた快適なアクションで、敵をかわしたときにスローになり、敵の背後に回ったり、大剣での攻撃モーションが美しかったりとても魅了されました
操作のしやすさ,-1,"アクション系は正直苦手なので、「走ってはダメ」などシビアなコントロール操作が必要な場面もあったりするのはないほうがよかったかもしれないです。"
操作のしやすさ,1,快適にプレイできています
操作のしやすさ,-1,移動が微妙に使いづらかった点は否めないです。
操作のしやすさ,1,アクションの操作性はスタイリッシュさはAutomataほどではないものの、魔法のバリエーション分だけ、私にはこちらの方が楽しかったです。
操作のしやすさ,-1,操作性は悪くないが、「前転」からのダッシュ、は、どうかと思う。
操作のしやすさ,0,コントローラー推奨(オートマタと同じ)
操作のしやすさ,1,コントロールの操作を適切に行う方法を理解した
操作のしやすさ,1,アクションも直感的に動かしやすく戦っていて面白かった
操作のしやすさ,1,アクション苦手な人向けの手助けもしっかりとなされている
操作のしやすさ,-1,ダッシュからの停止に若干の慣性が利いてるのが微妙。(ピタッと止まらない)
操作のしやすさ,-1,"多対1のターゲティングの操作性が×。視点を動かすとターゲットも動いてしまって、「そいつじゃない！」ってなります。魔弾などで非ターゲット状態でも、どこに発射するか表示できるようにしてくれると嬉しい(オートマタみたいなのを期待)。"
操作のしやすさ,-1,"使えるようになるしょぼいファストトラベルもアクセスが悪い上に、行けるところも少なく大して短縮になってないのでもの凄く使いづらい"
操作のしやすさ,0,アクション時の操作レスポンスは次作オートマタ寄りにチューニングされているので悪くないがやや単調で飽きやすいかも
操作のしやすさ,-1,操作性が悪いと感じた
操作のしやすさ,1,アクション部分が完全に刷新されており、ゲームプレイが非常に軽快になっています。
操作のしやすさ,-1,戦闘の操作性は割りと良い感じだけど、コンボパターン増やしてほしいのと、魔法セット数を増やしてほしい(L3余ってるし切り替えとかできないのかな)あとファストジャンプ追加してほしい。オリジナル版当時でも移動とかの不満点って結構言われてたはずだけど、その辺まったく改善されてないんですよね。
操作のしやすさ,-1,アクションは少し難点というか、理解するのに少し時間がいるかなと思います。基本的にこう戦うべきみたいなものが無いので自由度は高いのですがアクションが苦手な人は序盤が少し壁かなと思います。
操作のしやすさ,0,接入有线手柄需要进入游戏后再连接，否则无法操作。
操作のしやすさ,1,コントローラーをフル活用するゲームなので、㎰3版は初心者にはイージーでもかなり難しかったゲームですが、ロック機能がついてある程度易化しました。
操作のしやすさ,-1,操作も快適だが、それらを生かせるだけの敵のバリエーションやシチュエーションに欠けている
操作のしやすさ,1,操作性が良いと感じた
操作のしやすさ,-1,"ロックオン機能は勝手に外れる仕様となっている。目の前に複数の敵がいようもんならロックオン先がコロッコロ変わる。うざいったらありゃしない，やっててイライラする。それも相まって思わぬ方向に攻撃をしてしまう現象が多々発生した。マップ(GUI)も一言でいうならカス。全体マップを開いたときにサブクエの位置を分かりやすく表示する機能が無く、どこに行けばいいのか分からない場面が多々あり不親切。メニューを開いても、メインクエストの""次に何をする""という表示も無く分かりづらい。"
操作のしやすさ,1,オートマタよりは動かし易い感じ。
操作のしやすさ,1,自キャラの動きにキレが出て思ったままの動きをしてくれます
操作のしやすさ,-1,操作感もあまり快適ではなくジャンプ動作や視点操作がもっさりしててアクションゲームとして地味にストレスが溜まります。
操作のしやすさ,1,スピーディな戦闘、かっこいいモーション、軽快なアクションはオートマタのプレイ感覚に近く、この点に関しては文句なしの出来です。
操作のしやすさ,-1,苦痛な操作が強いられる
操作のしやすさ,0,操作としてのアクション難易度はそこまで高くはないように感じました
操作のしやすさ,1,アクションに関しては、プレイしてみて爽快だった。魔法と打撃のコンビネーションがスムーズで、スピードもちょうど良く楽しんでプレイできる。
操作のしやすさ,0,コントローラが認識しなくてちょっと手間取ったかな。
難易度の適切さ,1,マリオが難なくできる方なら問題ないレベルだと思います！
難易度の適切さ,-1,1周目は本当に苦行。がんばってクリアして2周目に突入するべし。
難易度の適切さ,-1,HP激減＆敵が固いだけという所謂意味なし高難易度なのでやる価値無いです。おとなくしノーマルかイージーでやりましょう。
難易度の適切さ,1,簡単でした。
難易度の適切さ,0,Easyでやると120点、Hardでやると5点のゲームであるということを覚えておいてほしい
難易度の適切さ,1,難易度はEasyに設定しオートでプレイするのがおすすめ
難易度の適切さ,1,バランスもアクションが苦手な私には丁度良かったです
難易度の適切さ,0,別に難しくもなく、ほど良い難易度だったと思います。
難易度の適切さ,-1,ストーリーもある意味「（精神的）苦行じみた繰り返し作業」ではあるけど・・・
難易度の適切さ,-1,めーーーちゃくちゃ大変です。苦行。
難易度の適切さ,-1,難易度はNormal以下ではかなり低く、周回でレベルが上がってきたらHardでもプレイ感覚はあまり変わらない。
難易度の適切さ,-1,オートマタから触れたひとはある程度の覚悟が必要だと思います
難易度の適切さ,-1,HARDの難易度の上げ方がダメージを上げるだけで、作業になってしまった。
難易度の適切さ,-1,武器強化素材のドロップ率が酷いのでトロコン目指す人は心を強く持ちましょう
難易度の適切さ,-1,青年編では武器強化しないと敵が硬すぎる
難易度の適切さ,-1,HARDモードはただただ敵が固くなるだけでかなりストレスになるのでNormalモードがおすすめです。
難易度の適切さ,0,周回前提で、automataほどに周回による変化がないため、冗長に感じる。周回時も敵のレベルは変わらないので、ただただ作業。敵がアイテムを大量にドロップしてくれたりワードが集まるので、戦闘に一定の楽しさがある。
難易度の適切さ,-1,途中まではハードでしたが硬くて攻撃力を上げただけのボスにイライラしたのでノーマルでクリアしました
難易度の適切さ,1,難しすぎる場合は通常ステージで雑魚を倒しまくってレベルを上げれば、戦闘は急速に楽になります。クリアしても何回でも挑戦できます。
難易度の適切さ,-1,武器強化の必要性を感じないほどの難易度ガバガバ設定だったりします
難易度の適切さ,1,アクションはニーアオートマタ風で爽快感のある簡単な難易度になっている。難易度HARDは敵がタダ硬いので難易度選択による面白さの変化はあまりないかも。
難易度の適切さ,-1,"セーブポイントが少ないので、ある場面をやりだしたらやりきるしかない点は難点かもしれません。"
難易度の適切さ,-1,ドロップ率は渋さがあり、武器の強化も複数武器をレベル最大にするのは苦行じみている気がします。
難易度の適切さ,1,2周目からはメインストーリーを最優先にこなせば、1時間半くらいでクリアーできます。雑魚はあまり相手にする必要ないです。
難易度の適切さ,-1,全実績解除までやりこむならば、相当の苦行を覚悟した方がよい
難易度の適切さ,1,かなり時間がかかるのでゆったり楽しみたい人向けです。
難易度の適切さ,-1,個人的なイライラポイントは、CDEエンディングに武器を全部集めないといけない点。DLCステージも全部クリアしないといけないのですが、この手のアクション操作苦手なんですよね、、、何度やってもジャンプ操作がクリアできないのでCDエンディングは諦めてYoutube見ました。
難易度の適切さ,0,進行できないクエスト等が出てくるが、他の実績については達成できるかもしれないと思った
難易度の適切さ,1,パリィやジャスト回避のタイミングはかなり甘く、DarkSoulプレイヤーなら、ボスキャラといえど武器強化なしでも楽に勝てるはずです。
難易度の適切さ,-1,全エンディングを見ようとするとどうしても単純作業が必要になります。特に素材集めで苦労すると思います。
難易度の適切さ,-1,ハードでやると敵がやたら硬いので面倒です
難易度の適切さ,-1,問題に遭遇したり進行不能になったため、難易度が適切でなかった
難易度の適切さ,1,難易度が良いと感じた
難易度の適切さ,-1,アクションが難しめです
難易度の適切さ,1,ただ、マリオが難なくできる方なら問題ないレベルだと思います！
難易度の適切さ,1,オートマタをイージーでもいいからクリアできているなら、レプリカントはノーマルでもクリアできると思います。しかし、もしオートマタをプレイしていないなら最初の難易度はイージーのほうがいいかもしれません。
難易度の適切さ,-1,即死攻撃してくる敵が、その辺に立っているのは問題だと思う。
難易度の適切さ,-1,ゲームが不慣れな人だと詰んでしまう恐れがないですかね？
難易度の適切さ,-1,実績コンプリートは苦行
難易度の適切さ,-1,実績解除に必要なアイテムが出ない出ない全く出ない
難易度の適切さ,1,自分は難易度ハードでやったほうがやりごたえがあって面白い
難易度の適切さ,1,EASY難易度を選べばアクションに苦労する事はそうそうありません。HARDで遊んでみましたが敵の耐久力や攻撃頻度が上がり相応に歯ごたえはある
難易度の適切さ,-1,クリアするだけなら簡単。やり込もうとすると苦行と虚無でハゲ上がる。
進捗の明確さ,1,自分のステータスのところにゲームの進行度に合わせたセリフが出ています
目的の明確さ,-1,周回前提バランスなので、ストーリー＋クエスト＋素材集めを常に併用して行い、最悪スルーする（次週に回す）ぐらいの気持ちでやると別ゲーになります。
目的の明確さ,-1,せめてゲーム内に「月光草は違う色の花を交互に植えるとよく育つらしいですよ」というような情報さえあれば
目的の明確さ,1,"主人公の強い信念があるからこそ、仲間が救われ、家族が救われ、そしてそれらを含めた正真正銘""全て""が失われる。"
目的の明確さ,-1,「目的」が何なのか、全くわからないままにお使いばかりさせられている。これは、何のために主人公が頑張っているのかがよくわからないで、時間だけが過ぎていった。
目的の明確さ,1,2週クリアを前提に作られていることが理解できた
目的の明確さ,0,あくまでこの作品は昔にヒットした作品をリメイクして懐かしむ事が目的で
目的の明確さ,-1,ストーリー背景の情報が不足しており、このゲームによって過去・現在・未来とどう繋がりどう影響するのか不明の為、中途半端なストーリーのRPGになっています。
目的の明確さ,0,ストーリーがよくわからなかったので、wikiを読んである程度理解しました
目的の明確さ,-1,物語の背景、設定、ストーリーの大部分が本編中には明かされず、プレイヤー自身が、ゲーム外で調べて、補完しなければならない
視聴覚の魅力,1,音楽をとっても、グラフィックをとっても、もちろんストーリーも。フルボイスで楽しむことができるので、感情移入のレベルが違います。新規さんでも復帰した方でも同じように楽しめる作品だと思います。
視聴覚の魅力,1,スケール、世界観、楽曲が素晴らしくそういう糞な要素を忘れてしまうほどよくできているのだ。
視聴覚の魅力,1,音楽も最高でまだプレイしていない方是非試してみてください。
視聴覚の魅力,-1,"グラフィックは一新、フルボイス化及び新録、オートマタ衣装や小説版のエピソードといった追加要素もあるもののゲーム自体は""ほぼそのまま""というレベル"
視聴覚の魅力,1,ストーリーやBGMなどは素晴らしいものなので
視聴覚の魅力,1,ストーリーが良いと思う。モブキャラに感情移入するほどのストーリー。
視聴覚の魅力,-1,PS3のオリジナル版に比べて、キャラクター達のビジュアルや世界の雰囲気は良かったです。綺麗になりすぎて、儚さや悲しい世界感・ダークな雰囲気が無くなってしまいました。
視聴覚の魅力,1,シナリオと音楽が最高です。設定が練られていて素晴らしいです。
視聴覚の魅力,1,リメイク前より格段に綺麗な絵、豊富なボイスと追加ムービー、更に追加ストーリーまで盛りだくさんで、前作プレイ済みで展開を知っていても面白かったです。
視聴覚の魅力,1,文句なしの完成度でした
視聴覚の魅力,1,ストーリーや音楽がいいからじっくり楽しみたい
視聴覚の魅力,-1,グラフィックの向上。フレームレートの向上。楽しさの増したアクション。サブクエストも含むフルボイス化。主要人物のボイスも使いまわしではなくちゃんと撮り直してた。各キャラのムービーにおけるリップシンク。旧作のＢＧＭを取り直し＆アレンジ。ロード中のヨナの日記等のリメイク。
視聴覚の魅力,1,グラフィックやシステム面は、2021年に8580円で売るものとはとても思えませんでした。テクスチャとサブクエもとても残念です。
視聴覚の魅力,1,音楽がとても良い。ポーズ画面でずっと聞いていられます。同じBGMが歌ありなし、リズムありなしなどが状況に応じてシームレスに切り替わり、盛り上げてくれます。曲数は多くないと思いますが、バリエーションの豊富さと演出との相乗効果でどの曲も思い入れ深いです。
視聴覚の魅力,1,音楽が特に最高。
視聴覚の魅力,1,グラフィックは綺麗になっているし、音楽も世界観とマッチしてプレイヤーの気分を盛り上げる
視聴覚の魅力,1,シナリオと音楽が肌に合う人にとってはストーリー展開や設定を深追いしたくなってしまう良ゲー。
視聴覚の魅力,1,キャビアの独特な垂直ジャンプや外へ出るときのライティングの変化など細かい部分もそのままになっているところも個人的にはうれしい部分です
視聴覚の魅力,1,キャラや世界観、BGMはとても好みです。
視聴覚の魅力,1,世界観とグラフィックはよいです。
視聴覚の魅力,1,好きな音楽聞きながらやると楽しいです
視聴覚の魅力,1,音楽・演出・ストーリーが全部100点満点でした。ゲームのスタイルが気に入った。
視聴覚の魅力,1,物語と音楽は全て最高です。特に物語性は:Automataすら凌ぎます。ゲームのスタイルが気に入った。
視聴覚の魅力,-1,表現が非常にソフトになっている感じが物足りなかった
視聴覚の魅力,-1,リメイクされたとは言えグラフィックは今のゲームレベルまでは綺麗になっていません　戦闘中や探索中のBGM聞けるだけでもう満足です
視聴覚の魅力,-1,音楽と世界観だけのゲームでした
視聴覚の魅力,1,グラフィックは設定はHIGHですが普通にサクサク動作します！
視聴覚の魅力,1,魅力的なBGM旧作プレイ時石の神殿のBGMを聞いてサウンドトラックを購入しました。久々にプレイして各場所でBGMを聞くと本当に良く出来ています。プレイが初めての人は高品質なBGMも楽しめるかと思います。
視聴覚の魅力,0,BGMやキャラの魅力はあると思いますが、何周も同じイベントをこなすうちにしらけてきます
視聴覚の魅力,1,こんなきれいな絵で重苦しい話を見れるんだ．最高だろ？
視聴覚の魅力,-1,キャラクターのCGと声と人魚姫が気に入らないのですが、楽しくトロコンしました。
視聴覚の魅力,1,世界観、ストーリー、キャラクター、音楽と、ゲーム内演出含めてセンスの塊です
視聴覚の魅力,1,音楽は最高で、オートマタのサントラも買いましたが、この作品のサントラも買うつもりです
視聴覚の魅力,1,ストーリーやBGMはもの凄く良く何度見ても涙を誘われるシーンがあったりしたのですが
視聴覚の魅力,1,世界観と楽曲は最高です。
視聴覚の魅力,1,画面はきれいだと思います。
視聴覚の魅力,1,物語と音楽がとても良い
視聴覚の魅力,1,グラフィックが向上しているのが分かります。美麗な絵でよりストーリーに引き込まれました。フルボイスで没入感が高かった。
視聴覚の魅力,1,見事に(ヨコオワールドに)ハマりました。
視聴覚の魅力,1,ゲームの世界観は素晴らしいですね。おもわず引き込まれます。
視聴覚の魅力,1,美しいBGM、綺麗な画像、透き通るような世界観、まさにニーアシリーズといった感じでした。
視聴覚の魅力,1,魔法がいちいちかっこよすぎる。厨二感あふれる名前とそれに負けないかっこいいエフェクトがマッチして適当に撃っているだけで楽しかった。
視聴覚の魅力,1,音楽もよい
視聴覚の魅力,1,ストーリー、ＢＧＭがとても良い。
視聴覚の魅力,1,良い点としてBGMが評価されている
視聴覚の魅力,1,このゲームにしか感じられない特別な雰囲気と世界観が魅力なので、トレーラー・キャラクターを見て少しでも気になった方は是非購入して欲しい。
視聴覚の魅力,1,音楽、話、キャラクター、世界観すべて好き
視聴覚の魅力,1,演出はニーアオートマタのような印象を受けるもので悪くはありませんでした。
視聴覚の魅力,1,BGMやグラフィック、アクション、ストーリー、ムービーなど高クオリティ。
視聴覚の魅力,1,ファンタジー的なステージに近代的な建造物が廃れた状態でいい感じに混ざり合っているあたりがいい感じに綺麗に見えた
視聴覚の魅力,1,シナリオが良い。わかりやすい。ゲームの見た目と雰囲気が気に入った。
視聴覚の魅力,1,BGMが良い。イニシエノウタを筆頭に、BGMがほぼ全てゲームとマッチしてとても綺麗です。
視聴覚の魅力,1,PS3時代よりもずっと綺麗になったグラフィックで、戦闘も爽快感が増している気がします
視聴覚の魅力,1,音楽が非常によかった。Nier Automataでいいなぁと思っていた曲のほとんどが、Replicantからの曲であったのと、それらの曲がそれぞれの名シーンに合わせて聞けたのは本当に良かった。
視聴覚の魅力,-1,ゲーム背景や設定はよく練られていると思いますがゲームをプレイするだけだと説明が少ないためにほとんど理解できず消化不良に陥りました。
