aspect,np,review操作のしやすさ,1,居合抜刀気刃切りってこんなに決めやすかったっけ...?
操作のしやすさ,1,遊びやすい
操作のしやすさ,-1,"操作には慣れましたがキーボードとマウスだと少し難しいですね。"
操作のしやすさ,1,コントローラーもＰＳコントローラーでプレイ出来て、ボタンも自分仕様に割り振れるので、モンハンワールドを思い出して出来るのも楽しいですねｗ ただショートカットが方向リセットと同じボタン（Ｌ１）なので、ショートカットが常に開いて戦いに集中できません＞＜ 多分ショートカットボタンを変更できると思うので、模索中ですかね。
操作のしやすさ,1,移動などのストレスが減っていて、同じ武器でもいろいろな戦い方ができてとても楽しいです！
操作のしやすさ,1,モンハンの遊び方がわかった気がする
操作のしやすさ,1,移動にかかるストレスが過去作と比べてかなり低減された
操作のしやすさ,1,ストレスなく狩りができるようなユーザーフレンドリーに変わりました
操作のしやすさ,1,翔虫というワイヤーアクションでDMCやベヨネッタのようなスタイリッシュな動きが出来る
操作のしやすさ,1,MAP上にある素材がボタン一回押すだけで手に入る
操作のしやすさ,1,過去シリーズの面倒くさかったところやイライラするほぼすべての仕様が、MHワールドより快適になって、素材採集も敵も迷うことなくナビゲートされ、戦闘面以外が超快適に遊びやすく生まれ変わったかのようなモンハン。
操作のしやすさ,1,遊びやすいと感じた
操作のしやすさ,-1,翔虫等のアクションの操作方法の説明が乏しい
操作のしやすさ,1,キーコンフィグが改善され、武器種毎の設定や同時押し設定を別の単一キーに設定できます。
操作のしやすさ,1,最初は操作に戸惑うことも多々ありましたが、慣れてきた今はとても快適な狩人ライフを送れています
操作のしやすさ,1,移動も快適で狩りに集中できます
操作のしやすさ,-1,近接武器種からガンナーに移行するのが難しい
操作のしやすさ,1,"ハンターのアクションが強力で、全体的にサクサク進む"
操作のしやすさ,1,アクションゲームとしての完成度は間違いなくシリーズで最も高いと思える
操作のしやすさ,0,あえて言うなら新作毎に操作が複雑化しており、新たに始めようという人の敷居が高くなり続けてる事が気になるくらいかな？
操作のしやすさ,1,全体的にもっさりとしていたモンハンからスタイリッシュな動きができるモンハンになった！
操作のしやすさ,1,操作もおぼつかない状態からストーリークリアまでサクサク進むことができました。
操作のしやすさ,1,ガンナー勢はマウスでエイムできるのがよいです。パッドの時は歯を食いしばりながらエイムしてる感覚でしたが、こっちではもっとリラックスしながらやれる。ショートカットもキーボードでやれるので、多ボタンマウスならポチポチで調合もできる。
操作のしやすさ,1,アクションが苦手な自分でも楽しめてる
操作のしやすさ,1,エリア移動の煩わしさが解消され、むしろ爽快感すらあります
操作のしやすさ,1,ゲーム内でのアクションの実行方法が分かりやすかった。ゲームをコントロールするための行動が明らかだった。ゲームの操作は簡単だと思った。
操作のしやすさ,1,ジャイロ設定して使うと遠距離エイムが楽
操作のしやすさ,-1,操作の重さに辟易としていた。回復薬を飲むのが遅いということ。どの武器も操作にクセがあり、初心者お断りみたいなものが多い。近接武器はスラッシュアックス、遠距離ではライトボウガンを選んでおけば初心者でも楽しめるように思う。技の切り替えもできるようになり、各武器の動作にヴァリエーションも増えて操作が軽快になる。
操作のしやすさ,1,操作がし易いです。快適すぎて別ゲームでした。
操作のしやすさ,1,グラフィック操作性ともに良好でした
操作のしやすさ,1,操作性は快適で、アクションゲームとしても個人的には高評価。ハンターの機動力が高いので、モンスターを狩りに行く際の手間なども最適化されており、モンスターごとに装備を変えるということも手間なく行えます。遊びやすさは素晴らしいです。
操作のしやすさ,0,入力操作がまた違う癖がある。先行入力が前より効かないらしいが真偽はどうだろうか。
操作のしやすさ,1,遊びやすく楽しいモンハンになってます
操作のしやすさ,0,操作に慣れるまでが大変。慣れると爽快で楽しい。
操作のしやすさ,1,色々と便利＆快適になってます。最初からマップが見えてモンスターの位置も見えたり、ガルクに乗って高速で移動できたり（乗って移動しながら砥石を使える）、キャンプが複数あって好きなキャンプにファストトラベルできたり、移動しながらアイテム食えたり（ガッツポーズ廃止！）、装備にマイナススキルが無い、などなど。翔蟲は慣れるのに時間掛かりましたが、もうこれナシではモンハンできません（笑）ダウンからの即復帰が超便利です。操竜はとっても簡単かつお得です。ただ普通にマウスを押して攻撃するだけでモンスターに大ダメージを与えてくれて一気に体力を削れます。これのおかげで一気に体力削れて優しいのかも？
操作のしやすさ,1,移動やUIの利便性は向上している
操作のしやすさ,1,武器収納を含む諸々のモーション速度も早めになっているため、「攻撃を食らう覚悟で無理矢理押し込む」などの戦い方も今まで以上に可能になった
操作のしやすさ,0,ゲーム進行としては既存のモンハンシリーズとだいたい一緒で、モンスターを討伐して素材を集め装備を強化し、キーとなるクエストをクリアして次のランクに進んで、となります。翔虫を使った移動の操作を覚えていないと、DLCのとある戦闘のフィールドギミックでほぼ確殺されるのでちゃんと覚えましょう。
操作のしやすさ,1,マップの作りこみや移動のストレスがない等非常にプレイしてて楽しい
操作のしやすさ,1,かなりやり易いです。反応が良い感じがします。攻撃をかわし易くなっている様に感じます。
操作のしやすさ,-1,プレイの仕方の説明不足があった
操作のしやすさ,1,操作できるように作られています
操作のしやすさ,-1,マウキーでの操作は微妙なのでコントローラーを使うことをお勧めします
操作のしやすさ,1,翔蟲アクションのおかげでアクション＆ある程度、移動も快適
操作のしやすさ,0,まぁ操作はできるんで支障はないのだけれども
操作のしやすさ,1,面倒な徒歩移動が犬で簡単になり、虫を使うことで高速移動や段差のジャンプが可能でとっても快適
操作のしやすさ,1,遊びやすいと感じた。プロコンが1番手に馴染む感じがする。初心者でも取っつきやすい良さがある。
操作のしやすさ,1,操作もすぐ受け付けてくれるのでナルガのフレーム回避も余裕になりました
操作のしやすさ,-1,操作設定も変えれないし意味が分からん
操作のしやすさ,1,かなりストレスフリーで楽しむことができると思います
操作のしやすさ,1,移動やアクションも軽快になってさくっと遊べてちゃんと今風になってるなぁと思いました
操作のしやすさ,1,ハンターのアクションにストレスがほぼなく、歴代で一番動かすのが楽しいです。
操作のしやすさ,1,移動など無駄な部分にかかる時間が少なく、モンスターを狩ることに集中できます
操作のしやすさ,1,"他のモンスターにも行動後の隙が用意されてる。XBOXコントローラーを繋げれば設定無しでプレイができる。エリア移動が楽になった。"
操作のしやすさ,-1,犬の操作性・挙動が悪い
操作のしやすさ,-1,操作性も悪いので快適さや面白さに欠ける
操作のしやすさ,1,移動も攻撃も非常に爽快
操作のしやすさ,1,慣れるとこれはこれで楽ですね
操作のしやすさ,-1,アイテムボックスやその他の街でのUIが基本的に悪く、意図したとおりに動かせずにストレスを感じたり、入力に対しての受付が非常に悪く、戦闘中に意図して入力したコマンドが別のものに化けてしまったり、そもそも入力されてない扱いで棒立ちになってしまうことも頻発します。
操作のしやすさ,1,"より遊びやすくなってもいます"
操作のしやすさ,0,操作性が過去作とはかなり勝手が違うので、ライズの操作感に慣れすぎると過去作のもっさり感が受け付けなくなってしまうかもだからそこだけ注意が必要かもです
操作のしやすさ,1,アクションゲーとしての出来は良く、某神食いゲーに近いです。
操作のしやすさ,-1,現状は「Switchのコントローラーをマウスとキーボードで操作している」ような状態です。単純なゲームであればそれで充分ですが、本作でこれは正直かなり無理があります。コントローラーのボタンに対してキーを割り当てるのではなく、機能(アクション)に対してキーを割り当てるべきです。キーボード設定は一見すると項目が多く融通が利くように見えますが、その実「コントローラーのボタン1つ1つをキーボードのキーに振り替えているだけ」という仕様が根底にあり、「複数機能がシステム的に同じボタンに設定されている」ものを別々のキーに分離することができません。複数ボタンの同時押し操作も同様にコントローラ向けの設定がそのまま流用されています。ボタン数が限られるが比較的同時押しが容易なコントローラー、キー数が多いが同時押しできる範囲に制限のあるマウス/キーボード、こういった特性の差に関する配慮不足が本作の大きな欠点です。
操作のしやすさ,-1,"コントローラーでボタン配置を変更出来ない(一部変更可)事に驚きました"
操作のしやすさ,-1,年々操作が複雑になってきたり
操作のしやすさ,-1,操作が多すぎてやってられなかった
操作のしやすさ,1,ライズのテンポ感と操作性で完全にハマり
操作のしやすさ,1,次の作品とか移動面で大丈夫？と思えるぐらいにはその辺快適
操作のしやすさ,-1,操作に使うボタンが多すぎる。武器種によって動作も全て変わるので、気軽に武器を変更できない。パッド操作のキーコンフィグができない。キーマウス操作のキーコンフィグがものすごく面倒。
操作のしやすさ,1,ワイヤーアクションやダッシュで地形を登れるのも良い
操作のしやすさ,1,狩りのシステムが以前のモンハンより快適になった
難易度の適切さ,1,目押しで成功するようになり、クエストクリア時の演出のカットもできるため、全体的にゲームの進行がスムーズである。
難易度の適切さ,1,中盤まで難易度が低い、簡単で遊びやすかった
難易度の適切さ,0,確かに難易度は下がっているように感じました
難易度の適切さ,1,難易度が低いおかげかかなり楽しめました
難易度の適切さ,1,モンスターの動きを覚えないといけない部分が多々出てきますが、努力が苦手じゃない人には非常におすすめできるゲームです
難易度の適切さ,0,"難易度自体も、わりとライトに抑えられているかな。"
難易度の適切さ,1,ヒトダマドリをちゃんと集めてからクエストを行えば、ステータスの余裕を以てして攻略に臨める。丁寧に遊べば難易度低めで、ゲーム難易度を時間と手間によって減少させられるシステムと言える。一方で、今後ハードなクエストが増えるかもしれないという不安は少しある。激ウマのアクションゲーマーでないレビュアーには助かっているが、間違いなくアクションゲームとしてはヌルくなっている。
難易度の適切さ,0,総じてぬるい！といったこともありませんでした。サンブレイクのエンドコンテンツで、今までのモンスターが嘘のように思える手強いモンスター達がやってきます。それを楽しみに無双していくのも良いかもしれません。強い奴らがホントに手強い。
難易度の適切さ,-1,ラスボス撃破までは程よい難易度で楽しいが、エンドコンテンツで疲労感を感じるほどの高難易度がある
難易度の適切さ,0,過去作より難易度は下がった（?）
難易度の適切さ,-1,今作のマルチは完全に野良だからクエストの成功率はどうしてもMHWより低いというのは事実です
難易度の適切さ,1,モンスターとの戦闘の難易度は、どの武器でも楽しく戦えるが、油断すると命は無いといったくらいの塩梅で、高くも低くもなくちょうどいいと感じる。
難易度の適切さ,1,もう少し難しくてもいいかな、とは感じますが万人向けを考えたらこのくらいが調度良いのかも知れません。追加版のサンブレイクの予定もありますから、後々難易度関連は変化があるかもしれません。
難易度の適切さ,1,簡単と言う人も居ますが高いランクのモンスターは甘えていたらちゃんと即死させて来ます。武具やスキル種類が多くて工夫次第ではアクション苦手な人も高難易度に入れるように上手く作られてると思います。
難易度の適切さ,-1,"2G,3rd等と比べると間違いなく簡単です。筆者は2Gの下位フルフルを時間切れ（50分経過）で失敗した経験がありますが今作では下位～MR（G級）を通して時間切れどころか25分かかったクエストがあるかどうかが怪しいです。PS次第ではありますが慣れて装備が整うとソロでも一狩り10分前後で終わります。複数体討伐クエストは体力が減らされているため単純に倍にはなりません。今では上位相当の初心者救済装備が最初から配布されている他、サンブレイクからはシングルプレイ時にNPCを連れていける盟勇のシステムがあるため相当サクサク進めると思います。"
難易度の適切さ,1,難易度自体はシリーズ初めての人におすすめできる
難易度の適切さ,-1,ハンターが強くなりすぎてるんじゃないかなって感じます
難易度の適切さ,-1,言うほど楽に進められるわけでは無い
難易度の適切さ,-1,百竜ソロだと無理ゲーな感じ
難易度の適切さ,0,初心者から上級者までの道のりが、両極端になっていると思います
難易度の適切さ,-1,難易度は従来のと比べると優しめです
難易度の適切さ,-1,傀異クエストの調整は本当に改善してほしい
難易度の適切さ,1,ライズは難易度的にはやさしめ。ボリュームはそこそこ。
難易度の適切さ,1,しっかりモンスターハンターだし、面白かったです。
難易度の適切さ,-1,エンドコンテンツのレベルの上げにくさ
難易度の適切さ,-1,アクションゲームとしての難易度もこれまでのMHに比べてはるかに難しくなっており、瞬間的な判断を絶えず問われる戦いになっているため、今作は合わない人には絶対に合わない。
難易度の適切さ,0,"アクションゲームの難易度としては簡単なレベルです"
難易度の適切さ,-1,怪異討究クエストのレベル上げは作業感が強く、効率よく周回するために自分が狩りやすい同じモンスターも狩り続ける事になるので他のゲーム等で感情を無くした周回ハムスターになっている方にはオススメできるかもしれません。
難易度の適切さ,1,バランスがとても良かった
難易度の適切さ,1,緊急クエストや上位の後半になるときちんと緊張感があるバランス。ゴリ押しじゃ死ぬのでちゃんと攻撃見て避けましょうという感じ。シリーズ初めての人も、初めての武器を覚えて一周しようという場合も、進める中で慣れていけます。
難易度の適切さ,1,ストーリーの難易度はアイスボーンと比べると優しいが、簡単すぎるわけではない
難易度の適切さ,-1,昔に比べ簡略化されたりしていてぬるく感じる人もいるかも？
難易度の適切さ,1,"一方モンハンらしさも残っていて、敵の攻撃はしっかり見て避けないと割りとあっさりやられてしまう。集会場上位なんかは雑なプレイはできなくなり、緊張感のある楽しい狩りができている。"
難易度の適切さ,1,モンスターが適度に弱くソロでもできる
難易度の適切さ,-1,昔の作品をやるとだいぶ難しく感じる
難易度の適切さ,1,難易度とプレイの快適さのバランスが見事にとれている
難易度の適切さ,-1,モンスターが全然倒れない。1体倒すのに40分ぐらいかかったぞ。ソロでやるときは里でみんなでやるときが集会所か。ここまでがチュートリアルでしょ？燃え尽き症候群ともいえるし、ルーチンワークを実感として明確に感じ取ってしまったとも言える。
難易度の適切さ,0,全体的な難易度は低くなっている印象はありますが、一部の高難易度クエストの難しさは従来通りで、しっかり準備したテンプレ装備を使用していても対策スキルなどがない状態では1撃で乙してしまうことも珍しくありません。
難易度の適切さ,1,基本的には簡単だが、生半可な装備とプレイヤースキルでは勝てないクエストも存在する
難易度の適切さ,-1,作品内の百竜夜行のタワーディフェンス型のクエストは初心者ではシステムが分かりずらいように感じる。
難易度の適切さ,-1,☆5から、あ、モンハンだ…。これこれ、この難しさがモンハンだ
難易度の適切さ,1,総合的な難易度をうまく下げた
難易度の適切さ,-1,悪く言えばぬるいモンハン、もはや人によってはモンハンらしくないとまで思いそうな難易度です。
難易度の適切さ,1,ゲームは難しかったが、難しすぎなかった
難易度の適切さ,-1,全体的に歯ごたえがなくなっていると感じました。簡単すぎるような印象を持ってしまいました。
難易度の適切さ,0,ちょっと難易度はぬるくなってるのかな？？？って感じるくらいですがまだ上位入りたてなので、これからの敵に期待します。
難易度の適切さ,1,過去のモンハンシリーズを遊んだことがない人でも新規で遊ぶには丁度いい快適なゲームとなっているので、是非手に取って遊んで欲しいと感じた。
難易度の適切さ,1,難しすぎなかった
難易度の適切さ,-1,上級までしかないのでMHW:IBしてる方には物足りないかもしれません
難易度の適切さ,1,やっぱ、ライトゲーマー程度の私にはライズ・サンブレイクぐらいが丁度いい
難易度の適切さ,-1,上位・下位ではほぼマッチングしないほどマルチは過疎ってる
難易度の適切さ,-1,モンスターの火力は進むにつれて超インフレしていくので気軽にハンティングしにいくとこちらがサクッとハントされるので色々疲れます
難易度の適切さ,-1,現状の難度としては正直過去一低いです。
難易度の適切さ,1,アクションも奥深くてやりがいがある
難易度の適切さ,1,敵もちゃんと強いからヌルゲーではない
難易度の適切さ,1,ワールドより難易度は低い印象。「初めてのモンハン」という人たちには非常に取っつき易いと思う。
難易度の適切さ,0,経験者だと前の作品のアイスボーンの難易度やボリュームに引っ張られてマイナスに観たくなるが切り離してみれば上限をなんとかやりくりしようとして煮詰め不足になってしまった印象
難易度の適切さ,1,一部とても素早いモンスターも居ますが、前作アイスボーンのような理不尽さはないです。総じて理不尽さを感じることが少なく、従来よりもハイスピードになったアクションを楽しめると思います。ゲームは簡単すぎず、難しすぎなかった。
難易度の適切さ,-1,高難易度クエストと銘打っていても火力防御面ともにインフレしているため「あれ？拍子抜け？」という感じになる
難易度の適切さ,1,"クリアまででも十分に楽しく遊べます"
難易度の適切さ,1,高難易度ではワンパンされることもあるので、装備を整える＆パターンを覚えるなど準備は必要だが、高難易度クエストをクリアできた時の達成感は格別
難易度の適切さ,1,高難易度なクエストもありますが例えば前作ワールドの絶望感が漂うようなクエストは今のところありません
難易度の適切さ,-1,難易度はどこ行ったの？
難易度の適切さ,1,最初は上位クエスト難しかったけれどだいぶ慣れた
難易度の適切さ,1,程よい手ごたえを感じるモンスターの強さ
難易度の適切さ,1,短時間での達成感が得られた
難易度の適切さ,-1,新モンスターは割と別ゲーで、需要が違って微妙
難易度の適切さ,-1,あっという間にクリアできてしまうことが良い事とは私は思いません。
難易度の適切さ,1,"ちょっとやり方覚えるともっと簡単に倒せるから"
難易度の適切さ,-1,敵が基本的に強化前提の強さに感じた。適正ランクのクエストでも、未強化だとある程度ゲームに慣れていてもそれなりにやられる。
難易度の適切さ,-1,敵が強くてビビっている
難易度の適切さ,-1,モンハンになれてる人は里クエと下位は簡単だと思うので、実質上位だけと考えると物足りないのかもしれません。
難易度の適切さ,-1,単純にバックステップや軸ずらしなどの、回避や対策が難しい行動をする敵が多すぎる。戦闘が長期化・高ストレス化してしまっている。
難易度の適切さ,1,難易度は今までのシリーズより簡単、ソロで遊びやすいなど、特に初めてモンハンを遊ぶ人に勧めやすい感じです。ゲームは簡単すぎず、難しすぎなかった。ゲームは難しかったが、難しすぎなかった。これを簡単だと一言で片づけるのはプレイヤースキルによるので何とも言えないですね。
難易度の適切さ,1,ラージャンが隙増えて戦いやすくなった
難易度の適切さ,-1,ゲーム全体の難易度は過去作品と比較しても優しく、翔蟲による復帰行動や鉄蟲糸技を使いこなせればサンブレイクのエンドコンテンツ「傀異討究」まではそうそうクエスト失敗などもなく攻略できると思います。初心者救済装備が配布されているが。ゲームの楽しさを壊して公式が壊してしまっている。MRで作ることができる（狂化）というスキルが完全に壊れておりゲームの難易度が著しく崩壊している。
難易度の適切さ,1,詰まる事なくクリアできました
難易度の適切さ,-1,ゲームはストレスを感じる難易度だった
難易度の適切さ,-1,終盤のアップデートで追加された狂化・奮闘・業鎧系の護石は入手やビルドがかなり難しいものの
