aspect,np,review
操作のしやすさ,1,モンハンの最新作は新アクションに加えて既存のシステムが非常にユーザーフレンドリーになりました。採取は一瞬で終わる。ピッケルも虫取り網もいらない。クーラードリンクもホットドリンクもいらない。普通の回復薬で50回復する。砥石は無制限に使えます。崖登りが超速い。常に自動マーキング。犬に乗って高速移動。ワイヤーアクションで飛び回る。サブキャンプで長距離移動。部屋に集まらなくてもクエストに参加できる。防具の見た目を自由に変更できる。
操作のしやすさ,1,プレイヤーキャラクターがよく喋るので状況の把握に必要な情報を喋る事があり、操作が楽になったと感じる。
操作のしやすさ,1,"笛が強くてとてもたのしいです"
操作のしやすさ,1,モンスターもハンターもぬるぬる動き、快適なハンティングアクションが楽しめます。翔虫アクションが豊富でマップ移動もラクラク軽快、狩猟は今までのターン（攻撃タイミングと受け/避け）シーンが少なく臨機応変に立ち回れてしのぎを削る場面がアクション性を高めています。全てにおいて「テンポが良い」に尽きます。
操作のしやすさ,0,操作性やゲームスピードよりも、全体的にプレイヤーが介入できない場面がかなり減ったことが大きな違いだと思います
操作のしやすさ,1,非常に遊びやすい。特に収集物の取得にいちいちしゃがまず、しかも速攻で複数のアイテムが手にはいるのは感動すらした。消耗品は自力で増やせるまたは購入できるので、ためらいなく使用できる。難しいクエストも簡単に応援を呼べる。弱点やドロップ率も分かる。なんて快適なんだろうか。
操作のしやすさ,1,"とてもとっつきやすくなった印象があります。移動はスイスイですし、収集要素もそう面倒なものもなくて実績厨でも安心！"
操作のしやすさ,1,アクションが行いやすい。特にMHRでは翔蟲という形で頻繁に宙を舞い、移動から戦闘に至るまで結構な比率でぴょんぴょんする。着地すれすれに攻撃したい動作が相当やりやすく感じる。チュートリアルがご丁寧で、初モンハンだろうが過去作既プレイだろうが問題なく馴染めるように出来ていると思う。リソース管理が必要な部分もあるが、極端に苦手な人でも大抵はすぐ慣れてしまえる要素ではある。
操作のしやすさ,0,様々な面倒を解消し初心者にもやりやすい仕様だと感じました。しかし、欲を言えば、ここまで敷居を下げたのであれば各武器のチュートリアルを準備してあげるところまでほしかったかなと感じました。
操作のしやすさ,1,操作に一切のストレスが無い。非常にカジュアルなゲームで、モンハンを触ったことが無い人はここから初めてみることをお勧めしたいです。最初の印象は「ものすごく遊びやすい！」でした。プレイ中に不満を感じた点はありませんでした。
操作のしやすさ,1,"かつてのシリーズ恒例だったストレス要素が大幅に削減され、遊びやすいタイトルになっています。モンスターの居場所はいつでもマップに表示/マーキングアイテム廃止。暑いだの寒いだの地域ごとに必須の消耗アイテムは廃止。アイテム使用時の変なモーション廃止。ダメージは数値で表示され弱点が判りやすく。拾った素材アイテムはある程度まで自動で調合。アイテム採取はモーションが短縮され、一度にまとめて取得。マップに採取地点が表示される。騎乗して高速移動できる最高の相棒、オトモガルク。協力的で感じのよい街のNPC達。極端な不細工とかいない。狩場は1枚MAPなので移動にロードを挟まない。等々……厳密には前作モンスターハンターワールドで既に改善されていた部分もあるものの、PSP/DS時代から比べると素晴らしく遊びやすくなっています。"
操作のしやすさ,1,モンハンのモッサリとした感じを全体的に排除し、快適性に特化している
操作のしやすさ,1,ガルクはプレイヤーが操作できるため、前作より使いやすくなった
操作のしやすさ,1,アクションは軽快でスタイリッシュ、以前はほぼ全武器に配られたカウンターアクションに馴染めなかったけど、お手軽に強い
操作のしやすさ,1,非常に丁寧なチュートリアルから始まって、ちゃんと説明してくれて、とても親切です
操作のしやすさ,1,犬による高速移動、敵がマップに常に表示されているので追跡時間の大幅短縮が可能になりました。バリスタや大砲の弾を拾ってのそのそと戦っていた防衛戦も大幅に変化。乗りシステムが大幅に変更されました。殴ると相手は素材を落とし、暴れた後片方は必ず逃げるか怯んだ後に乗る事も可能なので一度だけで大きなチャンスとなります。狩猟笛の仕様が大きく変わり使いやすくなった。
操作のしやすさ,1,快適なゲームデザインの一部として機能させているのは脱帽の極み
操作のしやすさ,1,遊びやすさやアクション面に力が入れられています。手に馴染む感覚がありました。
操作のしやすさ,1,全体的に従来のモンハンの不便な要素がなくなっているようなので、全体的に不自由さがなく楽しめた
操作のしやすさ,1,ムービースキップなどもあり非常に遊びやすい
操作のしやすさ,1,ゲーム起動時やクエスト開始時は読み込みが少しありますが他では感じずテンポが良い
操作のしやすさ,1,"アクションゲームとしては快適に遊べる "
操作のしやすさ,1,ボタンを押下してから反応がワールドより一瞬遅れる感覚が無くなっている
操作のしやすさ,1,操作がきびきびしている
操作のしやすさ,1,全体的にはMHWを踏襲しながら、自由に速く移動出来るガルムに騎乗して、フクズクに敵の位置を教えて貰いながら狩りをします。翔蟲を使ったアクションは、良い意味でMHらしくない立体的でアグレッシブな動きが可能になっており、受け身も跳びながら可能なので吹き飛ばされた時のストレスは減っています。
操作のしやすさ,1,もっさりとした操作感が薄れて、スタイリッシュなアクションを濃くした感じです
操作のしやすさ,0,"新規が入りやすくなっている作品だなと感じました"
操作のしやすさ,0,キーマウ、パッドどちらでも操作性は悪くないです。ただ昔に比べると操作項目が増えてるので慣れるまでは時間がかかるかもしれません
操作のしやすさ,1,ゲームはテンポよく進められる
操作のしやすさ,-1,やや複雑さを増している操作関連、使いにくいUIやショートカット
操作のしやすさ,1,アクションゲームが苦手な方でも遊びやすい。操作簡単で見た目も良い双剣、サポートもできるし技が使いやすい笛、触って楽しいスラアクなどなど。
操作のしやすさ,-1,早替えや蟲技で複雑化しすぎたアクション
操作のしやすさ,1,ボタン設定はゲーム側では一部のボタンしか変更出来ませんがsteam側で他のゲームと同様に自由に設定可能勿論パッド部分も自由自在、複数ボタン同時押しを設定すると楽かも
操作のしやすさ,1,マップ移動の楽しさ・爽快さがあり、オトモガルクによって素早く移動でき、翔蟲システムによって自由度高く移動できる。採取やマップのシステムの改善も素晴らしい。
操作のしやすさ,1,クラッチ関連が翔蟲アクションに変わり遊びやすさに進化
操作のしやすさ,1,"コントローラで遊ぶこと、マルチプレイに積極的に参加すること、色々な武器種を使って楽しむことを特にお勧めしたい"
操作のしやすさ,1,プレイヤー側の快適さを極力上げたようなモンハン。マップの移動は狼のガルクで快適に行なえ採集は過去作と比べると短い時間で済むようになりました。今作の目玉の翔蟲アクションは従来機動力の無いような武器種でも飛び回ったりでダイナミックな動きができるようになりました。戦闘自体は今までのモンハンよりも動きやすくシステム面も快適なので何となくアクションゲームで周回プレイをしたい時にはいいかもしれません。
操作のしやすさ,1,進化したアクションと移動面のテコ入れ、翔蟲受け身などによる、他のシリーズと一線を画する圧倒的な快適さが売り
操作のしやすさ,1,ターゲットの捜索や素材収集がめちゃくちゃ楽しい
操作のしやすさ,1,アクションが多彩になっていて特に翔虫を使ったアクションと新たに追加されたお供のガルクという要素も相まって面倒くさい部分に大幅にテコ入れが入って高速化した最新版のモンハン。移動はガルクで快適に、今までツタが無いと登れなかった壁も走って登れるように進化した。
操作のしやすさ,1,モンハンの軸となる「ちゃんと避けて」「攻撃する」という楽しさは変わっていません。受け身で立て直しが速いのと相まって、トライアンドエラーがストレスにならず、初心者でも段々と読めるようになっていくのが楽しい。
操作のしやすさ,1,ゲームパッド使用可能です
操作のしやすさ,1,"チュートリアル用のクエストもあって順々に操作を覚えられるように出来てるので、初めてプレイする方にも向いてるかと思います。"
操作のしやすさ,1,初心者にも優しく爽快感あるアクションゲームだと感じました
操作のしやすさ,1,"非常に遊びやすく、また爽快感のある戦闘になった。回復薬は歩きながら飲め、ガッツポーズもなくなった。砥石すらガルクに乗れば動きながら研げる。非常に遊びやすくなった箇所をあげればキリがないほどです！"
操作のしやすさ,-1,コントローラーを使用する際の設定に注意していただきたく。Aを押すべきところでBが表示されていたりするので、少々混乱してしまいました
操作のしやすさ,1,とっつきやすいと思う。超絶ユーザーフレンドリー
操作のしやすさ,-1,入力を受け付けない時間が長すぎる
操作のしやすさ,1,縦横無尽に駆け回れるのが爽快ですし素材集めもサクサクできるので、ストレスを感じることなく楽しめてます。
操作のしやすさ,-1,操作に手こずる。ダクソみたいな操作を想定していたので全然違う操作感に軽く混乱。どのクエストからやればいいのかちょっとよくわからない。初心者にもうちょっとわかりやすく説明してもらえませんかねぇ…。
操作のしやすさ,1,最高のモンハンであると感じた
操作のしやすさ,0,この操作感から戻れるだろうか…
操作のしやすさ,1,移動しやすく、便利になっている。そのため、今までMHシリーズをやったことのない人にもおすすめできる作品となっている。switch Proコントローラー を使用しているので操作感に違いがない
操作のしやすさ,0,基本操作の練習用というイメージがある
操作のしやすさ,1,プレイしやすいです
操作のしやすさ,1,ゲームの起動はじめ挙動が軽くてさくさく手軽にプレイできます。アクションも楽しく、シンプルで面白いゲームです。
操作のしやすさ,1,マウスキーボードでできるのはやっぱり楽しい。AIMがしっかりつけられる。ショトカが使いやすいし早いってのはでかいと思います。
操作のしやすさ,-1,改悪された操作設定　ー＞一部キーに割り当て不可能になってより不便に。
操作のしやすさ,1,ハンターやモンスターのもっさり感が消え、よりスピーディーに遊ぶことが出来るようになりました。
操作のしやすさ,1,操作をしやすくしてストレスを減らした
操作のしやすさ,1,非常に快適
操作のしやすさ,1,モンスターのモーションを盗むカウンター技などはとてもやりやすくなりますね。
操作のしやすさ,1,遊びやすいです。アクションが苦手な方にもいいです。
操作のしやすさ,1,犬や翔虫での快適な移動
操作のしやすさ,0,初心者でも取っつきやすい様に色々吹出し等で指示をくれたりするので優しめだと思います。武器の操作説明などはかなり雑なのでYoutube等で使い方講座を見ることをお勧めします。
操作のしやすさ,1,システムが非常にプレイヤーフレンドリーになっていることで、快適にプレイできました。高速・立体的な移動はもはや旧作には戻れないほど便利。
操作のしやすさ,1,翔蟲による移動のしやすさと、マップ上方向への探索可能範囲など単純に狩りをしないで世界観を楽しむプレイも満足できる仕上がりでした。
操作のしやすさ,1,システム自体の快適度は比較にならないほど向上している。特に翔虫を使ったアクションの数々は過去作には戻れないくらいに楽しいものとなっている。ダウン回避から戦闘中での高速移動、はては合流してしまったモンスターの片割れを操ってしまうなど過去作とは別ゲーレベルへと進化している。
操作のしやすさ,-1,操作ができないのもあって普通に勝ててたようなモンスターに3乙させられたりと理不尽感が半端ない
操作のしやすさ,-1,UIの不便さがある
操作のしやすさ,1,操作性も戦闘も100点
操作のしやすさ,1,アイテム周りもユーザビリティ重視でプレイしやすいのも好感触
操作のしやすさ,0,操作性はモンハンらしくあまり好みではないが、チュートリアルも丁寧なのでちょこちょこプレイしていきます
操作のしやすさ,1,アクションも面白くカッコいいです。忍者ムーブがあり、壁を走ったり、鉤縄的なもので空中飛んだりします。
操作のしやすさ,1,移動がとても楽だった
操作のしやすさ,-1,操作性やフィールドの広さなど不便とストレスが多かった
操作のしやすさ,1,盾で殴ったり、弓は飛びながら打ったりとかなり多彩な戦いに進化してました。マップ移動がかなり楽になったのもよい点でした。
操作のしやすさ,1,ボウガンが使いやすいので何とかなってる感じ
操作のしやすさ,1,"操作性の向上などたくさん恩恵があり、とてもプレイしやすくなってます。"
操作のしやすさ,1,"むつかしい操作はいずれ体が覚えてくるはず。やられたっていいんです。このゲームは何度負けようとも詰む事がありません。まずはご自身の思うまま戦ってみてください。"
操作のしやすさ,-1,ボタンの反応鈍い。ワールドではなかったけど、ボタンの反応が鈍くってなかなか反応しないときがある。これは大きなストレス。
操作のしやすさ,1,カウンター技や吹き飛ばされた後の復帰が容易になるなどモンハン初心者におすすめできると思う
操作のしやすさ,1,移動を始め、快適になっている要素が多数あるので遊びやすい作品だと思います。オトモガルクに騎乗することにより、フィールドを高速移動できるようになりました。また、翔蟲によるジャンプや壁走りといったアクションを使ってマップ内を立体機動できるようになりました。翔蟲を使って飛ばないと見つけられない要素がマップに隠されていることもあるので、マップ探索の楽しみも広がっていると思います。ストレスが少ないハイスピードな戦闘で一部とても素早いモンスターも居ますが、前作アイスボーンのような理不尽さはないです。ゲームの操作は簡単だと思った。
操作のしやすさ,1,操作が簡単になって親切設計でいろいろな情報がみれて攻略サイトいらずになってます
操作のしやすさ,1,移動面のストレスはもうなくなったといってもいいレベル、最高です
操作のしやすさ,-1,"ガルクの操作性は悪いと思う。段差登りきれなかった時のストレスは半端ない。移動はガルクと壁走りありきの調整にしてると思うけど最初からこんなもん実装すんな。体感だと過去作より移動はダルい。壁走りの操作性はまじでクソだし。操竜中のロックオンもまじでゴミ。モンスターとイロヅキムシが一緒に存在するとロックオンが荒ぶってイロヅキムシ狙うのが非常に困難。というか操竜の操作性もピーキーで、ロックオンされてても変な方向に進む時がある。"
操作のしやすさ,0,少し操作に自身がなくても他のモンスターを操って攻撃させたり
操作のしやすさ,1,移動や攻撃が非常に勝手の良いものとなりました。移動ストレスも少ないです。
操作のしやすさ,1,ワールドで特に面倒だった街中の移動も快適になってます
操作のしやすさ,1,"遊び易いです"
操作のしやすさ,1,3次元の移動が楽なこともあり、作りこまれたマップを縦横無尽に駆け巡ることができます。ゲーム内のヘルプも充実
操作のしやすさ,1,初心者にも優しくプレイしているとほぼ自動的に上手くなるくらい丁寧に流れが作られているところも凄すぎます。
操作のしやすさ,1,"初心者にも優しいって点ですごいいいと思いました。"
操作のしやすさ,1,これ以上ないくらいやりやすいと思ってます
操作のしやすさ,-1,操作性の難しさがある
操作のしやすさ,1,ガルクで移動が高速化されたため、モンスター探しや乙った後の復帰のストレスが大幅に緩和されました。これが一番ストレスだったので嬉しい。
操作のしやすさ,1,ハンターにとって煩わしく感じる要素がこれでもかというくらい簡略化されており、それでいて新要素の説明はしっかりしていたので古いモンハンしか知らなかった私でもすんなりとのめりこむことができました。
操作のしやすさ,1,四方八方に飛び回るアクションはストレスフリーだった
操作のしやすさ,1,使いづらい部分は改善を感じられ、手軽にオンラインで協力プレイが出来るのもGOOD
操作のしやすさ,-1,武器は快適だったモーションのレスポンスが全て重苦しくなり先行入力がほぼ消滅して不便さが上がってるのでガンナー以外は動作でラグと感じるレベル
操作のしやすさ,1,"元が携帯機向けだから軽くて快適というのがアクションとしては好感触なのもある"
操作のしやすさ,1,過去作で面倒だったアイテムや使用が軒並み削除され初心者にもわかりやすくなった。翔蟲やガルクによってマップ移動がとても快適になった。
操作のしやすさ,1,シリーズ復帰者にとってとてもお優しい感じでおすすめです
操作のしやすさ,1,モンスターの分かりやすい動きやボイスによる危険のお知らせも親切です
操作のしやすさ,1,読み込みが爆速で、採集とか移動もめっちゃ快適なってる
操作のしやすさ,-1,操作レスポンスが悪く動かしていてあまり気持ちよくない
操作のしやすさ,1,操作もナンバリング時代のもっさり感が無くなった
操作のしやすさ,-1,操作が面倒なことが気になった
操作のしやすさ,-1,居合抜刀鬼神から特殊納刀ができる快適さ、満足感はありましたが深みが失われた感満載です
操作のしやすさ,1,狩りやシステム周りもかなり、手軽になって、ライトユーザーや初めてモンハンされる方にも非常におすすめです
操作のしやすさ,1,プレイ自体は非常に快適になったモンハン
操作のしやすさ,-1,エイムが楽だが、弾やビンの変更、鉄蟲糸技が押しにくいのでキー変更がほぼ必須なように感じました
操作のしやすさ,1,アイテムを見つけるのは分かり易い
操作のしやすさ,-1,全体的に煩雑で尚且つ重い操作性
操作のしやすさ,1,武器操作の快適性はかなり良い
操作のしやすさ,1,"移動面では翔蟲による空中移動とガルクによる高速移動が大変便利で、システム面では採取が１回で済んだり、痕跡を集めずとも敵の位置がわかるようになりました。"
操作のしやすさ,1,スタイリッシュに動かせて楽しいです
操作のしやすさ,1,移動手段が快適になり、翔蟲とガルクで移動が楽ちんだった
操作のしやすさ,1,ガルクとマップと盟友と翔虫のおかげでワールドよりも何倍も遊びやすくなっている
操作のしやすさ,1,初心者にもターゲット層の海外も含め、遊びやすくまとまっています。
操作のしやすさ,1,うごきもきびきびしていて快適です。
操作のしやすさ,1,移動も楽になり、マップも比較的分かりやすくなり
操作のしやすさ,1,お供ガルクや操中要素はプレイ快適度や機動力を大幅に上げている
操作のしやすさ,1,盟友やマルチがやりやすく
操作のしやすさ,1,アクションが過去最高にきびきび動けるとこが素晴らしいです。
操作のしやすさ,1,サンブレイク(ver15)時点で、シリーズ史上最高に遊びやすいモンスターハンターだと思います。良い点・ガルクに乗れる！お手もできる！モフモフできる！・素材収集がワールド系列より更に簡潔になった・ヒノタマドリをしっかり集めれば割と安全・操竜システムを活用すれば手ごわいモンスター達にも手伝ってもらえる・（マスターランクの大部分で）盟勇が人数を補ってくれる、タゲ分散だけでなく賑やかさもアップ
操作のしやすさ,0,操作は複雑になっています。数をこなしていくうちに使えるようになりますが、操作ミスをしてしまうとモンスターを追うのに時間がかかってしまうことなどが多々あります。
操作のしやすさ,0,"過去作と比べてもストレス要素が解消されていて大変遊びやすい"
操作のしやすさ,1,様々なアクションが可能になり、カウンター、無敵時間の利用、ハイパーアーマー等を用いてモンスターの攻撃をいなす事が容易になった
操作のしやすさ,1,たくさんの仲間プレーヤーと様々なコンテンツを楽しめる遊びやすいタイトルとなっていると思います。
操作のしやすさ,-1,操作が複雑化しすぎて気軽に色んな武器を使えない
操作のしやすさ,1,翔蟲を使っての縦横に飛び回るアクションは新鮮で楽しいです
操作のしやすさ,1,わかりやすいUIや作中の手厚いサポート要素に助けられた
操作のしやすさ,1,移動がかなり快適になっていい感じ
操作のしやすさ,1,キーボード・マウスでも遊べますね。むしろ、遠距離武器はマウスの方がダメージを出しやすい。
操作のしやすさ,1,"非常にやりやすいモンハンで面白いです。アクションの豊富さにやりやすさがあり、モンスターを操る事も出来る。爽快さと気軽に出来るのが今回のウリ。サンブレイクからはNPCも一緒に連れていく事も出来るようになりオフライン専門の方にもとても遊びやすくなっています。"
操作のしやすさ,0,敵に向かって正面を向いて攻撃するのって慣れるまで大変だったな。
