aspect,review
操作のしやすさ,モンハン最新作は、ユーザーフレンドリーなシステムで快適に遊べる。採取や移動がスムーズで、アイテム取得が早く、中断も少ない。翔蟲を使ったアクションが新鮮で、初心者でも学びやすいチュートリアルが用意されている。全体的にストレスが減り、アクションへの取り組みも楽しく、過去作に比べて格段に快適な体験が提供されている。
難易度の適切さ,全体的にこのゲームは難易度が低めで、初心者でも楽しみやすい設計になっている。ただし、高難度のクエストも存在し、適切な装備や戦略が求められる。プレイヤースキルによっては難しさも感じるが、全体的に快適なゲーム体験が提供されている。
進捗の明確さ,
目的の明確さ,今作『モンスターハンターワールド』の受付嬢に対する不満があったが、ライズではカムラの里の人々が魅力的であると評価される。ゲームの目的は明快で面白いが、エンドコンテンツは強化されたモンスター狩りが続くため、ワールドに比べると物足りなさがある。
視聴覚の魅力,モンハンライズは高画質、高fpsで快適に遊べ、和風の雰囲気が魅力的。BGMの質も良く、特にカムラの里の曲が印象的。グラフィックは前作に劣るが、ゲーム体験は十分満足いくもの。新たなアクション要素も楽しめ、オトモたちもかわいい。システムやバランスが優れており、全体的に爽快感があり、楽しいゲームだ。
遊ぶ意義,本作はモンハン初心者にも最適で、システム改善や遊びやすさが感じられる。懐かしの友人たちとの思い出が蘇り、感情が揺さぶられる。狩りの快感や装備作成の楽しさがあり、十分に楽しめる内容。ストレスなく遊べ、歴代の中でも特に好きな作品で、遊ぶ価値があると感じた。
没入感,ゲームに夢中になり、没入感が強く、時間を忘れるほど楽しめた。翔虫を使った新しいアクションや、ストレスフリーな戦闘が魅力で、敵との瞬時の判断を楽しめる。全体として、過去作に比べ没入しやすいが、一部のキャラクターやストーリーへの愛着が薄れると感じる部分もあった。
成長感の得やすさ,今作は初心者にも優しく段階的に理解を促す仕様で、快適に楽しめると感じる。スキルやプレイスタイルの合致が重要で、成長実感も得やすい。難易度が低めで、色々な武器種を気軽に使える点が良い。操作に慣れると爽快感があり、やりがいも感じられる。全体的に非常に遊びやすく、アクションが苦手な人にもおすすめの作品である。
好奇心への刺激,モンハンの進化に興味を持ち、「ライズ」が新規に向いていると感じている。新要素「翔蟲」やNPCとの共闘クエが楽しみで、やりこみ要素が豊富。サンブレイクに期待しつつ、多様な武器やモンスター探索が楽しめる。アップデート情報にも期待しており、飽きることなく新鮮な体験ができそうである。
自由度,防具の見た目を自由に変更でき、武器やキャラクターのカスタマイズが楽しめる。フィールドを自在に移動できることで、探検や狩りが快適になり、ストレスが軽減された。特にフレンドとの協力プレイやNPCの活用が魅力的で、初心者にも優しいのが特徴。全体的に遊びやすく、自由度が高いゲームデザインが評価されている。
