aspect,np,review視聴覚の魅力,1,日本語サポートの表示がありませんがインストールすると自動的に日本語化されており、音声まで全て日本語化されているので安心して楽しめます。
視聴覚の魅力,1,そうしたスピード感を殺すことのない腰うちの精度、ストーリー分野でもRPGに引けを取らない良シナリオ、間違いなくリリースする時期を間違えていなかったらFPSの看板を背負っていてもおかしくなかった神作品です。
視聴覚の魅力,1,シナリオは楽しいです ロボの通信が超まじめなのでカワイイです
視聴覚の魅力,1,シナリオもクリアできました。面白かったです。
視聴覚の魅力,1,ゲームのスタイルが気に入った。ゲームの見た目と雰囲気が気に入った。私はゲームの美学を高く評価した。
視聴覚の魅力,1,日本語音声、日本語字幕が収録されていました。
視聴覚の魅力,1,日本語で音声も日本語でした
視聴覚の魅力,1,ゲーム自体はかなり良い出来
視聴覚の魅力,1,ストーリーやキャラクターを中心とした質が高く満足感が凄い。オープニングで語られるパイロットとタイタンの『絆』、エンディングでクリティカルヒット。
視聴覚の魅力,1,エーペックスみたいな雰囲気でとても気に入りました。
視聴覚の魅力,1,タイタン等のグラもよし、ゲーム性もよしの神ゲー。
視聴覚の魅力,1,演出と高低差のあるマップと、Half-lifeシリーズとPortalシリーズの良いとこ取りな感じもあるので、お手軽に休日に終わらせられるFPSとしてはおすすめ
視聴覚の魅力,-1,BTのグラフィックやその他タイタンのグラフィックがデスクトップPCでは多少荒いです。
視聴覚の魅力,1,キャンペーンモードでは特殊トドメ演出以外は一人称視点を徹底することで没入感があるだけでなく映画のような演出やBGMの数々で世界に惹き込まれる他、何気ない会話の選択肢から”自分で選んだ言葉”で相棒のタイタンとおしゃべりする場面があり、プレイヤーが能動的に世界に浸っていける演出もにくいです。
視聴覚の魅力,1,グラフィックもサウンドも戦闘バランスも素晴らしいと思う
視聴覚の魅力,1,世界観がしっかりしているし、とにかく綺麗なので、他のレビューにもある通り(あったか？)プレイアブル映画という感じがしっくりくる気がする。
視聴覚の魅力,1,背景の美しさやキャラクターの立ち、ストーリーの内容など、全般的に品質に関して文句はない
視聴覚の魅力,1,内容はとても良かった
視聴覚の魅力,1,ストリートは王道的なものでヒロインのBTが可愛すぎる！FPS+ロボットで壁走りができてカッコいいです
視聴覚の魅力,1,キャンペーンも映画みたいでイイ！
視聴覚の魅力,1,荒んだ世界観とのギャップに癒されますｗ
視聴覚の魅力,1,とっても面白いゲームです。立体的でスピード感のある銃撃戦が楽しめます。かつて体験したことのないようなhigh pinを体験できます。
視聴覚の魅力,1,爽快なアクション、タイタンの操縦。キャンペーンも内容が濃く、評価しています。
視聴覚の魅力,1,最高に熱いシナリオと演出そしてスピード感あふれる3Dアクションが楽しめるゲームです
視聴覚の魅力,-1,内容が面白そうだっただけに余計がっかりです。
視聴覚の魅力,-1,たまに不自然な低音ボイスで話すときもあるし…
視聴覚の魅力,-1,ゲーム内容が微妙で爽快感がなかった
視聴覚の魅力,1,グラフィックも綺麗ですし
視聴覚の魅力,1,FPS×機動力×ロボットのスタイリッュシゲー
視聴覚の魅力,1,ゲーム性としてはハイスピードな戦闘とずっしりとしたタイタンによる戦闘どちらも遊べて、更にその２つのバランス調整も良いためどちらの要素でもとても楽しめます。
視聴覚の魅力,1,ストーリーもバトルも面白かったです
視聴覚の魅力,1,とにかく画質がいい
視聴覚の魅力,1,画質が非常に良かった
視聴覚の魅力,1,巨人同士の銃撃戦は迫力に溢れていますよ！
視聴覚の魅力,1,作り込まれた世界観が素晴らしいと感じた
視聴覚の魅力,1,タイタンの重厚な動きもしっかり迫力がありますし、各ステージのギミックは全部異なり、中だるみすることもなく、ゲームから離れていましたがまる３日ほど没頭してしまいました。
視聴覚の魅力,1,アクションも気持ちいいし、ストーリーもチャプター２までしかできてなかったけど好きだった。
視聴覚の魅力,-1,非常にクオリティの高いゲームですが、過去のゲームですので今後そのあたりが改善・対策される見込みは薄いと思います
視聴覚の魅力,1,プレイ後にはまるで一本の映画を見たかのような充実感があります。ゲームのスタイルが気に入った。
視聴覚の魅力,1,特にキャンペーンモードのストーリーがゲキ熱
視聴覚の魅力,1,キャンペーンの内容はよかった
視聴覚の魅力,-1,めちゃくちゃおもろいからすごく残念
視聴覚の魅力,1,グラップル＋フラトラ＋適当なタイタンで圧倒的安定型
視聴覚の魅力,-1,デフォルトの音量設定だと爆発音が過大だった。
視聴覚の魅力,-1,画面がラ満だった
視聴覚の魅力,1,SFやメカメカしく武骨に作りこまれたマップのデザインは圧巻です。ゲームのスタイルや世界観に満足でした。
視聴覚の魅力,1,ロボットに乗って闘うという男子の夢が叶います。
視聴覚の魅力,0,無比震撼，协议三出来了一瞬间泪目
視聴覚の魅力,1,世界観に惹かれた
視聴覚の魅力,1,タイタンの無骨なメカメカしいロボット感がよい
視聴覚の魅力,1,グラは綺麗
視聴覚の魅力,1,かなり色々な場面で　へー　ってなります
視聴覚の魅力,1,キャンペーンのストーリーは映画さながらで非常に良かったです。タイタンはかっこいいしパイロットもかっこいいです。これだけでも十分やる価値があると思います。BTに惚れた。
視聴覚の魅力,1,ゲーム自体もぐんぐん引き込まれて時間を忘れるほどでした。
視聴覚の魅力,1,王道エンタメアクション映画のような満足感
視聴覚の魅力,1,ストーリーは最高です。
視聴覚の魅力,1,近未来的なギミックもあれこれ存在し、プレイヤーを飽きさせません
視聴覚の魅力,1,ストーリーは良いらしいのでそっち目当てならおすすめ
視聴覚の魅力,1,グラもPS4より細かく向上
視聴覚の魅力,1,ロボットAIに萌えれる人は涙せよ
視聴覚の魅力,1,非常好的一款游戏
視聴覚の魅力,1,リッチなグラフィック
視聴覚の魅力,1,心揺さぶる良ストーリーがあなたを魅了すること間違いないでしょう。ゲームのスタイルが気に入った。魅力的な武器が多数登場。爽快の一言に尽きます。ド派手なロボットアクションもこのゲームの特徴の一つです。
視聴覚の魅力,1,演出もすごく良くて没入感満載。
視聴覚の魅力,1,8年前でこのクオリティはちょっとすごいと思う
視聴覚の魅力,1,ゲームのスタイルが気に入った。
視聴覚の魅力,1,洋ゲーの悪い部分を最小限に抑えて、上手くまとめているって感じのゲームだった。
視聴覚の魅力,-1,ゲーム自体は面白いだけに残念
視聴覚の魅力,1,最高に面白いゲーム
視聴覚の魅力,1,ゲームのスタイルが気に入った
視聴覚の魅力,0,ゲーム性やキャンペーンの内容はいいのに
視聴覚の魅力,1,ストーリーはマジでよかった
視聴覚の魅力,1,BTが可愛いゲーム。
視聴覚の魅力,1,ストーリーの内容は神なので　信じて！
視聴覚の魅力,1,映画をプレイしてるみたいで感動した
視聴覚の魅力,1,キャンペーンのストーリーがとてもイイ！パイロットとロボットの友情、その後の感動は涙を誘われます。
視聴覚の魅力,1,グラフィックは綺麗だし、SFシューティングの世界観がしっかりしていて良い エフェクトも派手で移動やアクションはスピード感が素晴らしい
視聴覚の魅力,1,ストーリーはとても感動的で面白かったです。
視聴覚の魅力,1,爽快だしタイタンに乗ったときの無双感も良き
視聴覚の魅力,1,画質も良く、ロボットの戦闘は迫力があります。
視聴覚の魅力,1,感動する
視聴覚の魅力,1,ストーリーと音がいい。
視聴覚の魅力,1,タイタンのアビリティやULTは画面が見えなくなる時がある程派手で、タイタン同士の戦闘は迫力が凄まじく映画の中のパイロットになった気分になれる。
視聴覚の魅力,1,音声も含めてちゃんと日本語化されています
遊ぶ意義,1,タイタンフォールからしか摂取できない栄養があります
遊ぶ意義,1,機械である相棒との友情を描いたキャンペーンモードは、FPSゲームの昨今のキャンペーンモードの中では特筆すべきシナリオだったと個人的には思う。
遊ぶ意義,1,キャンペーンもすごく面白いので、保存できない事で遊ばないのは非常にもったいないです。
遊ぶ意義,1,タイタンとの絆を実感できる
遊ぶ意義,1,遊ぶ価値があります。面白いです。
遊ぶ意義,1,ストーリーがまるで映画を見たかのような感動を受けました。壮大なワールドで臨場感ある闘いができ感銘を受けました。
遊ぶ意義,1,キャンペーンの面白さと熱さは数あるFPSの中でもトップクラスではないでしょうか
遊ぶ意義,1,タイタンのBT-7274が最後には欠かせない相棒と思えるようになるという熱い物語を体験できる最高のゲームです
遊ぶ意義,1,ストーリー(キャンペーン)は迫力に溢れていてクリアしたあとの達成感は凄いです
遊ぶ意義,1,大切なものとの共鳴の感覚があった
遊ぶ意義,1,パイロットとタイタンの絆というテーマに共鳴を感じ、映画化されるべきほど感動的に思った。
遊ぶ意義,1,ストーリーが良い
遊ぶ意義,1,apex繋がりでプレイしましたが、非常に面白かったです。所々apexの元ネタになった要素が発見でき、ヴァルキリーに繋がるヴァイパーのセリフを聞いたときは興奮しました。apexが好きな人ほどより楽しめると思います。
遊ぶ意義,1,ロボとの絆が大切なものとして感じられた
遊ぶ意義,1,プレイすると当時はあれだけ毎日プレイしていたのに意外と忘れていて、当時を思い出しながら楽しんでます。
遊ぶ意義,1,パイロットとタイタンの誇りと絆が描かれた名作
遊ぶ意義,1,ストーリーをプレイする為だけでも買う価値はあります
遊ぶ意義,1,ゲーム自体は非常に面白く壁走り、シューティング、ロボット操作などと男心を擽る内容でプレイしていて胸が熱くなりました。
遊ぶ意義,1,クリアした直後は良質な映画を観終わった時のような余韻を味わった
遊ぶ意義,1,もうこのゲーム無しでは生きていけません。
遊ぶ意義,1,"シングルキャンペーンでは戦闘を通してAIロボットと搭乗者の交流が描かれており、共に危機を乗り越えながら信頼関係を築いていく様がいろいろな形で表現されている"
遊ぶ意義,1,このゲームは私にとって意味のあるものだと感じた。傑作です。好きなら迷わず買いましょう。
遊ぶ意義,1,タイタンに搭載されてるAI、BTくんがかわいい。終盤は泣きそうになりました。
遊ぶ意義,1,遊んで良かった！と心から思ったゲームです。ロボットに乗れるだけのFPSだと思っていましたが、全然ただのロボットじゃなかった…BT尊いよ、最高の相棒だよ…BTとパイロットの掛け合いをいつまでも見ていたくなるようなお話でした。
遊ぶ意義,1,初めてストーリーで泣かされたゲーム
遊ぶ意義,1,絆がいいですね
遊ぶ意義,1,BTには愛着が沸きました
遊ぶ意義,1,キャンペーンのシナリオは完成度が高くこれをやるためだけでも買う価値がある
遊ぶ意義,1,"この6時間というのは大作SF映画の三部作の1～3に相当する分量と配分になっていて、全部プレイするとまさに良く出来たSF映画1本見終わったという満足感がありました。"
遊ぶ意義,1,キャンペーンでは機械（タイタン）と人間（パイロット）の厚い友情が描かれ
遊ぶ意義,1,私としては、最高のFPSの一つになりました
遊ぶ意義,1,ロボットやAIとの絆モノが好きな方にお勧めです
遊ぶ意義,1,シナリオはパイロットとロボット(AI)のバディものです。徐々に増えるAIのボキャブラリ、軽快なやり取り、構築される信頼関係…と特に捻りはありませんが「こういうので良いんだよ」をまっすぐに投げてきて、にんまりしてしまします。私がこのゲームで最も優れた部分を挙げろと言われたらシナリオと答えます。
遊ぶ意義,1,ストーリーやキャラクターを中心とした質が高く満足感が凄い。オープニングで語られるパイロットとタイタンの『絆』、エンディングでクリティカルヒットですよ。
遊ぶ意義,1,達成感がとても大きかった
遊ぶ意義,1,主人公とタイタン（仲間のロボット）との関係がとても感動します
遊ぶ意義,1,名作だけあって苦労して対策する価値はあると思います。
遊ぶ意義,1,ゲームをプレイすることは私にとって有意義だった。このゲームは私にとって意味のあるものだと感じた。このゲームをプレイすることは私にとって価値があった。
遊ぶ意義,1,ゲームは愛され続ける意味があると感じた。
遊ぶ意義,1,シングルではBTとの友情を深められます
遊ぶ意義,1,最高のゲームです！遊んでいるだけでロマンに満たされる
遊ぶ意義,1,遊びごたえがあります
遊ぶ意義,1,タイタンとの絆を感じた
遊ぶ意義,1,キャンペーン後半で2回泣かされてすごく好きになりました
遊ぶ意義,1,ゲームで救われた感じがしました
遊ぶ意義,1,物語がとても良かったです
遊ぶ意義,1,今後私たちの社会で発展していくであろう人工知能とこのような強い絆が生まれればいいなと夢見ながらプレイしていました
遊ぶ意義,1,人気FPSであるAPEXとつながっている世界観
遊ぶ意義,1,キャンペーンモードのみプレイ。長編の映画を見ているような感覚で、パイロットとタイタンの「絆」に焦点を当てられたとても良い作品でした。
遊ぶ意義,1,充実感があります
遊ぶ意義,1,名作と評されているゲームとは知っていましたが、想像以上に自分には刺さった内容でした
遊ぶ意義,1,主人公に感情移入してプレイできた
遊ぶ意義,1,特にキャンペーンモードのストーリーがゲキ熱
遊ぶ意義,1,楽しめました
遊ぶ意義,1,ロボットに乗って闘うという男子の夢が叶います
遊ぶ意義,-1, -1
遊ぶ意義,1,タイタンの無骨なメカメカしいロボット感がよい。BTとプレイヤーとの男の友情感のある展開が非常によかったです。
遊ぶ意義,1,"ゲームとのつながり、大切なものとの共鳴の感覚を感じた"
遊ぶ意義,1,ゲームがCOD4MWとの繋がりを知った時には運命を感じ、APEXへの興味が高まったと述べている。現在のゲーム体験がAPEXをやる気にさせた。
遊ぶ意義,1,試合に負けたけど最終的に相手チーム全滅させて離脱とかね。負けたけど精神的には勝ったみたいな。色々なドラマが生まれるんですよこのゲームは。
遊ぶ意義,1,タイタンに憧れ、乗る訓練は受けているものの、ただの一般兵。これがひょんなことからタイタンに乗るのだから、萌えないはずがない。
遊ぶ意義,1,ゲームをプレイすることは私にとって有意義だった。このゲームは私にとって意味のあるものだと感じた。このゲームをプレイすることは私にとって価値があった。
遊ぶ意義,1,遊ぶ意義があった
遊ぶ意義,1,ストーリーで感動した
遊ぶ意義,1,このゲームをプレイすることは私にとって価値があった
遊ぶ意義,1,王道エンタメアクション映画のような満足感があった
遊ぶ意義,1,ストーリーとか戦闘面は本当に面白いので、今から遊ぶなら悪い事は言いません。ストーリーだけ遊びましょう。
遊ぶ意義,1,APEXとのつながりもたくさん見られてほんとにおもしろかった
遊ぶ意義,1,このゲーム自体は歴史に残るレベルの神ゲーです。特にキャンペーンは他の方が仰る通り全FPS史上最高だと思います。
遊ぶ意義,1,心揺さぶる良ストーリーがあなたを魅了すること間違いないでしょう
遊ぶ意義,1,機械と人の友情ものが好きな人には特におすすめで、主人公とロボットとの絆が物語を通して深くなるのが感動であると感じることができる。ストーリーが感動的で意味のあるものである。
遊ぶ意義,1,ストーリーはマジでよかったので一度はやってほしい
遊ぶ意義,1,信じて！というテーマが心に響いた
遊ぶ意義,1,ゲームを買う価値があります
遊ぶ意義,1,キャンペーンのストーリーがとてもイイ！パイロットとロボットの友情、その後の感動は涙を誘われます。キャンペーンだけでもやる価値はあります。
遊ぶ意義,1,ストーリー最高なのでやるべき
遊ぶ意義,1,意味わからんくらい記憶に残る神ゲー
遊ぶ意義,1,ストーリーはとても感動的で面白かったです
遊ぶ意義,1,BTとのやりとりが本当に素晴らしい相棒としてのBTの存在が堪らなかった
遊ぶ意義,1,なによりメインミッションのストーリーは、映画にして欲しいです。他のレビューを見ていただければ高評価の嵐だと思います。クリアしても思い出して、もう何週もしていますが、なぜか飽きがこない素敵なゲームです。
遊ぶ意義,1,ゲームとのつながりが感じられた。ストーリーは機械と人間の絆という王道テーマで感動でき、世界観も壮大だった。
遊ぶ意義,1,ストーリーは感動できる
没入感,1,夢中になって戦場を駆け回りいつの間にかキャンペーンが終わってしまう
没入感,1,プレイ中は周囲の状況に気付かなくなった
没入感,1,私はダッシュし攻めるというスピード感のあふれる楽しみを提供してくれる。プレイの中にグルーヴが誕生し自然とテンションが上がってしまう。
没入感,1,止め時がわからず続けてやってる
没入感,1,気持ちよく暴れまわることが出来て楽しい
没入感,1,もはやプレイする映画と言ってもいいほどのめりこみました
没入感,1,ストーリーがまるで映画を見たかのような感動を受けました。壮大なワールドで臨場感ある闘いができ感銘を受けました。
没入感,1,ストーリーが男の子が大好きな内容が敷き詰まった内容で引き込まれる内容です。
没入感,1,プレイ中は周囲の状況に気付かなくなり、戦闘に完全に集中していた。
没入感,1,素晴らしい映像クオリティとフルボイスによるゲームへの没入感がすごく高い
没入感,1,私はゲームに夢中になった。
没入感,0,プレイ中は周囲の状況に気付かなくなった
没入感,-1,没入感が妨げられた
没入感,1,正直超楽しい
没入感,0,プレイ中は周囲の状況に気付かなくなった
没入感,1,壁を使った三次元的な高速戦闘は本当に魅力的
没入感,1,ストーリーも一つの大作映画を見たような満足感が得られる感動的なものでした
没入感,1,迫力があるグラフィックとサウンドで心から楽しめた
没入感,1,没入しぶっ続けのプレイでした
没入感,0,熱中しすぎるとすぐに終わってしまう
没入感,1,プレイしていてめちゃくちゃ気持ちいいです
没入感,1,プレイ中は周囲の状況に気付かなくなった
没入感,1,戦闘中でも好きなときに切り替えることができます
没入感,1,物語に没頭できる
没入感,1,キャンペーンモードでは特殊トドメ演出以外は一人称視点を徹底することで没入感があるだけでなく映画のような演出やBGMの数々で世界に惹き込まれる他、何気ない会話の選択肢から”自分で選んだ言葉”で相棒のタイタンとおしゃべりする場面があり、プレイヤーが能動的に世界に浸っていける演出もにくいです。
没入感,1,プレイ中は『この先の展開が気になるがストーリーを終わらせたくない』という気持ちを強く覚えた。
没入感,1,まるで映画の中にいるような感覚であっという間にクリアしてしまった
没入感,1,特に搭乗後の没入感とタイタンが降下してくるワクワク感は何ものにも代え難く
没入感,1,プレイしてる間にパルクールの複雑な動きを自然と利用するようになるだろう
没入感,1,私はゲームに夢中になった
没入感,1,ボロ泣きしていました。
没入感,1,巨人同士の銃撃戦は迫力に溢れていますよ！
没入感,1,まる３日ほど没頭してしまいました
没入感,1,一本の映画を見たかのような
没入感,1,夢中になってプレイしました
没入感,1,戦闘に集中しすぎて「あれ？自分何のために戦ってるんだっけ」とストーリーを忘れることもなく進められる
没入感,1,无比震撼，无以言表
没入感,-1, -1
没入感,1,プレイ感もよく、ストーリーもよい。
没入感,1,プレイ中は周囲の状況に気付かなくなった。私はゲームに夢中になった。私は試合に完全に集中していた。
没入感,1,普通に楽しい、バトロワ無理なんで自分は此れに籠るしかないし。タイタンも立ち回りとか操作とか難しいけど、俺はメカを操作出来るだけですでに楽しい。
没入感,1,キャンペーンのシナリオにワクワク感があり、その感覚がラストまで続くと感じた。
没入感,1,プレイ時間で言うとそう長くはないですけど、最高の体験が出来ます。
没入感,-1,プレイ中は周囲の状況に気付かなくなった
没入感,1,ゲーム自体もぐんぐん引き込まれて時間を忘れるほどでした
没入感,1,壁走り中に敵を射撃したり、中々ハイスピードなアクションが楽しめます
没入感,0,壁を飛び移り浮遊感を味わいながら、あるいはスライディングしながらの射撃は爽快感こそありますが、失敗したら割とあっさり返り討ちにされます。
没入感,1,没入感に圧倒された。演出がすごく良くて没入感満載である。
没入感,1,プレイヤーキャラの挙動やBTの挙動が気持ちいい感じで上手くまとまっている
没入感,1,映画をプレイしてるみたいで感動した
没入感,1,爽快だしタイタンに乗ったときの無双感も良き
没入感,1,私はゲームに夢中になった。パートナーのロボットを「信じて」一緒に難関を超えるのが爽快です。
没入感,1,私はゲームの中でパイロットになった気分になれた。タイタン同士の戦闘は迫力が凄まじく、夢中になった。
成長感の得やすさ,1,慣れると自分の周りでボンボンと汚ぇ花火大会を開催できる
