aspect,np,review好奇心への刺激,1,このゲームも算是开创了先河
好奇心への刺激,1,シーズン２も楽しみ
好奇心への刺激,1,マップやギミックを覚えよう！
好奇心への刺激,1,新しいレベルと服を楽しみにしてるよ
好奇心への刺激,1,アップデートでステージが大きく変化するのも〇
好奇心への刺激,0,今後のアップデートなどでチーター対策などを行ってくれることを期待
好奇心への刺激,1,今後も定期的に新ステージがアップデートされていくことが予想され息の長そうなゲーム
好奇心への刺激,-1,現在はチーターが一人もいない試合ってあるのか？という状況です
好奇心への刺激,1,今後ステージ含めて増えていくようなので更に期待しています
好奇心への刺激,1,みんなはいくつ見つけられるかな？
自由度,0,ゲームを抜けることも出来ますが、せっかくなのでチーターのいない決勝を見届けようと思います
自由度,1,誰でも勝者になれるし敗者になれる良いゲームだと思いますさあ君もプレイして本物の床と偽物の床を判別するんだ！
自由度,0,出来れば個人戦だけがマッチングするモードが欲しいというのが本音です
自由度,1,まじめに優勝を目指すもよし、知らない人をつかんで困らせてもよしという選択肢があるように感じた。
自由度,1,自分のやり方で自由にゲームをプレイできた。このゲームをどうプレイするかについて選択肢があるように感じた。このゲームをどうプレイしたいかという自由を感じた。
自由度,1,ゲームをどうプレイするかについて選択肢があるように感じた
自由度,1,フレンドとわいわい気楽にプレイする分には十分楽しめる
自由度,1,自分のやり方で自由にゲームをプレイできた
自由度,1,自分のやり方で自由にゲームをプレイできた。このゲームをどうプレイするかについて選択肢があるように感じた。このゲームをどうプレイしたいかという自由を感じた。
自由度,1,パーティーゲームにふさわしく
自由度,1,自由にゲームをプレイできた
自由度,0,好きなステージを選べる一人用やフレンドのみの練習モードが欲しいですね。
自由度,0,ランダム性があるといいなとも思いました。
自由度,1,単純な操作なのでアクションが苦手でも楽しめる
自由度,1,フレンドがいなくてもパーティゲームが遊べる。
自由度,1,様々な仕掛けに吹き飛ばされる豆たちを見ているだけで楽しい
自由度,-1,名前を好きなように決められないとか意味ないじゃん・・・。
自由度,0,自分のゴーストと競えるモード、ひとりで遊べるモードが欲しい
自由度,1,シンプルなので楽しく遊んでしまいます。
自由度,1,自由にゲームをプレイできた
自由度,1,自分で設定するのではなくランダム生成で、さらに何度も変えられるようですのでより気軽に遊べるかと思います。
自由度,1,クロスプレイ対応なのでコンソール版の友人とも遊びやすくなった
自由度,1,デュオやトリオ、スクアッドなど協力プレイのイベントもあり、友達とも楽しめます！
自由度,1,楽しく自分のペースでプレイできる
自由度,1,十分操作できています
自由度,1,自由探索でゆるく交流しながらもちもちできる
自由度,1,カスタムで友達同士で遊んだり、大会も開いたりできます。
自由度,0,自由度に関する言及があった
自由度,-1,自分は下手。
自由度,1,気軽に遊べるようになった
自由度,1,複数のPTでタイミングを合わせて疑似カスタムマッチにもできる
自由度,1,気軽にプレイできていいゲームだと感じた。
自由度,1,1ゲーム十分程度なんでサクッと遊べる
自由度,1,簡単に楽しめるかわいらしいバトロワゲームなのでオススメ。
自由度,0,ルーム作成機能(ルールも決められるとさらに良い)が欲しいですね。
自由度,1,のんびりたくさんのミニゲームを楽しみたい
自由度,1,絶対に優勝したい、負けたくないとかがなければ長く楽しめそう。
自由度,1,操作がシンプルで、回転が速いので、ちょっとやりたい方も、じっくりやりたい方も楽しめると思います。
自由度,-1,操作性が悪くてアクションゲームの腕前の差が出にくいところが良い
自由度,1,自分のやり方で自由にゲームをプレイできた。このゲームをどうプレイするかについて選択肢があるように感じた。このゲームをどうプレイしたいかという自由を感じた。
自由度,0,ソロonlyモードやチーム戦モードなどあればいいかなと思いましたがマッチキューの数が増えると分散してしまってマッチしないという現象になりかねないのでまあ難しいのかなと思います。
自由度,1,気楽に遊びたい時に軽く遊ぶゲーム
自由度,1,真面目に頑張るもよし。前のヤツの足を引っ張るのもよし。とりあえず体当たりしてみるのもよし。
自由度,1,自分のやり方で自由にゲームをプレイできた
自由度,1,各ミニゲームを自由にトレーニングができるモード
自由度,1,一人でプレイしても面白いが、フレンドさんとやると尚楽しめます！
自由度,1,やたら掴みかかってくるプレイヤーとかの出会いを楽しむべきゲームです
自由度,1,操作も非常に単純で、自由に楽しめると感じた
自由度,1,今時の上品なゲームにはない汚さがこのゲームにはある
自由度,1,気楽に遊ぶのに向いていると感じる
自由度,1,友達とやるもよし一人でゆるく暇つぶしするのもよし
自由度,1,自分で極めるタイプのゲームではないため、自由に楽しむ感覚があった
自由度,1,課金などをしなくてもたくさんのスキンなどを購入できるのも魅力的だ
自由度,1,負けてもいいじゃないという自由を感じた
自由度,1,自分で名前を変更できるようになったよ！！
自由度,1,ランキング形式で競うというのがなく、常に自分のペースでプレイできる
自由度,1,チャットがないので、暴言もなく、ゆるいつながりで軽くオンライン対戦できる
自由度,1,ステージや参加人数などを調整できるカスタムマッチが出来れば盛り上がりそう
自由度,1,このアプデで各ステージにランダムギミックが実装され毎回違う展開が楽しめる様になりました
自由度,1,大人数でワイワイ楽しい
自由度,1,ゲーム内容もわかり易く、すぐプレイできすぐ終われるシンプルなゲーム。
自由度,1,自分好みに変えられるのもよき
自由度,1,操作も簡単なのでゲームが苦手な人にもおすすめしたいです
自由度,1,オンライン対戦を気楽に楽しめるのがGOOD!!
自由度,0,自分の得意なミニゲームが来ることを祈りながら苦手なゲームをどうにか攻略する
自由度,1,自分のキャラクターの配色を選べるようなので、あと一時間は粘れそうです。
自由度,1,フレンドがいなくても楽しめるよ《重要》
自由度,1,大人数でパーティ系ゲームをやってみたい！と思っていた人にはドツボだと思います。
自由度,1,気軽に出来る
自由度,1,気軽に遊べる
自由度,1,たくさんの遊びがある
自由度,1,まだまだ楽しめそうです
自由度,0,無料のPS4でやるが吉
