aspect,np,review視聴覚の魅力,-1,初期の頃BGMから改悪BGMに変わったことが不満だった。ゲームのスタイルが変わったことに対して萎えた。
視聴覚の魅力,1,革新的で神ゲーに分類されるゲームであると思う
視聴覚の魅力,1,完璧な部分がある
視聴覚の魅力,1,音楽とステージ、そしてキャラクターがマッチしてるので見ているだけでも楽しめる作品です。ゲームの見た目と雰囲気が気に入った。
視聴覚の魅力,1,キャラクターの可愛さ、BGMの良さ等とても評価できる点は多いです。
視聴覚の魅力,1,シンプルイズベスト
視聴覚の魅力,1,キャラも可愛いし色使いも良く、わちゃわちゃしながら楽しめるゲームと思いきや
視聴覚の魅力,1,キャラと競技が可愛いので良い意味で笑いが出る。
視聴覚の魅力,1,パーティーゲームにふさわしく、買って損はないです
視聴覚の魅力,1,見た目をゆるゆるのカワイイ系でコーティングしてる
視聴覚の魅力,1,歩いている姿がかわいい 手を振るエモートがかわいい 他のbeanに掴まれて動けなくなる様がかわいい ハンマーに殴られて吹き飛ばされる様がかわいい ショーから脱落して情けなくﾎｯﾎﾎｫ~ｩ...と漏らす声がかわいい
視聴覚の魅力,1,ポップなキャラクターで暴力も武器も流血もないから親御さんも安心だ
視聴覚の魅力,1,ポップでキュートな見た目を裏切らず、負けても楽しい、いやむしろ不測の事故で爆笑できるゲームになっている。
視聴覚の魅力,1,キャラクターがすごくかわいい。
視聴覚の魅力,1,最初は面白い。取り敢えずわちゃわちゃしてほっこりする。
視聴覚の魅力,1,かわいらしいキャラクターが大好き！
視聴覚の魅力,1,キャラクターのかわいさ、クリエイティビティに富んだコース、高ランクコスチュームをゲットしようと夢中になれる要素がたくさんある。
視聴覚の魅力,1,音楽や雰囲気も楽しいゲームです
視聴覚の魅力,1,このゲームのデザインはとても素晴らしいので楽しみ
視聴覚の魅力,1,単純でかわいい見た目と軽快なボイスでキャラクターを愛し
視聴覚の魅力,1,わちゃわちゃ動くビーンズが可愛い
視聴覚の魅力,1,かわいい豆たちの醜い落とし合いを眺めるのがこのゲームの醍醐味。ゲームの見た目と雰囲気が気に入った。
視聴覚の魅力,1,ゲームのスタイルが気に入った
視聴覚の魅力,1,見た目相応可愛くなり人はいっぱい居るので
視聴覚の魅力,1,アバターが可愛くてお勧めです
視聴覚の魅力,1,キャラクターも可愛いし、いろいろなジャンルのステージが楽しめる
視聴覚の魅力,1,多彩なギミックがあってプレイしても見ていても楽しくて運動会のような気分でプレイできます。
視聴覚の魅力,1,音楽やキャラクターのかわいさは見ていて楽しい
視聴覚の魅力,1,可愛いキャラ達がもみくちゃになってるシーンに楽しく笑える人には絶対オススメ
視聴覚の魅力,1,全体的に明るくおバカっぽい雰囲気なので負けても笑えたりするゲーム
視聴覚の魅力,0,"графика,цена,много персонажей"
視聴覚の魅力,1,ガイズのデザインは完ぺきであり　かわいすぎ、ＢＧＭもいいのでぜひ遊んでくださいね。
視聴覚の魅力,1,可愛い見た目が気に入った。
視聴覚の魅力,1,奇妙なスライムに癒されます。
視聴覚の魅力,1,ゲーム性はすごい面白いと思います
視聴覚の魅力,-1,かわいらしい雰囲気のゲームだと思って買うとガッカリするかもしれません。
視聴覚の魅力,1,グラフィックの鮮やかさと底抜けに明るい感じ、大好き。
視聴覚の魅力,1,いい音（ＢＧＭ）でしょう？余裕の音だ、地力が違いますよ
視聴覚の魅力,-1,とにかく面白いゲームなのだが運営の頭が足りてない気がする
視聴覚の魅力,1,面白いし可愛い。
視聴覚の魅力,1,かわいらしいバトロワゲームなのでオススメ。普通に声出して笑ってます。
視聴覚の魅力,1,素晴らしい、カラフルな世界が気に入った
視聴覚の魅力,1,邪魔されても、障害物のコンボでひどい目にあっても笑えてしまうゆるいキャラの外見と動き
視聴覚の魅力,1,ゲームのスタイルが気に入った。ゲームの見た目と雰囲気が気に入った。私はゲームの美学を高く評価した。
視聴覚の魅力,1,衣装や模様、カラーリング、スッキリとしていて好きです。マッチング中のBGMのベースがいい。
視聴覚の魅力,1,世界観が可愛い　子どもでも大人でも、とっつきやすいデザイン。音楽が良い　プレイを邪魔しない程度に、ノリノリで可愛い曲。
視聴覚の魅力,0,ゲームは楽しいけど
視聴覚の魅力,1,ゆるキャラが頑張っている姿がとっても笑えます
視聴覚の魅力,1,雰囲気は悪くない
視聴覚の魅力,1,いい音楽のおかげでFall Guys人気になることはびっくりではない
視聴覚の魅力,1,見た目がかわいいのとBGMも合わさって
視聴覚の魅力,1,ポップでキッチュでカワイイ
視聴覚の魅力,1,キャラは可愛らしく、見ている分には微笑ましい
視聴覚の魅力,1,ビーンが走るのを見ているだけでなごむ。
視聴覚の魅力,1,衣装がかわいいです。
視聴覚の魅力,1,karakterlerin yürüyüşleri atlayışları zıplayışlayı hem çok tatlı hem çok komik
視聴覚の魅力,1,絵柄とかBGMとかかわいくて好き
視聴覚の魅力,1,キャラクターも可愛くBGMも楽しい感じで、マッチングもすぐ出来るのでサクサク遊べる。
視聴覚の魅力,1,ゲームの見た目と雰囲気が気に入った
視聴覚の魅力,1,ゲーム自体は頭を空にして楽しめる、良いゲームだと思います。
視聴覚の魅力,0,フォントが少しダサいのはご愛嬌・・・
視聴覚の魅力,1,ゲーム自体の雰囲気はほんわかして楽しい
視聴覚の魅力,1,キャラクターが可愛い！ゲームの見た目と雰囲気が気に入った。
視聴覚の魅力,1,Beautiful
視聴覚の魅力,1,見た目もとても可愛いものでまじまじ眺めると一種の趣と愛嬌があります。変な要素（暴力やブラックジョークの類など）がない純粋な笑いとトンチキを提供するのも良い点です。つまり、うちの親からそのへんの子供、画面の向こうの多次元的存在まで誰でも楽しくプレイできる数少ないタイトルです。
視聴覚の魅力,1,characterかわいいし通貨も結構くれるから欲しいスキンを手に入れるのにそんなに時間がかからない
視聴覚の魅力,1,ポップな見た目が気に入った
視聴覚の魅力,-1,ステージやキャラの色が派手なせいか、非常に目が疲れます。
視聴覚の魅力,1,ほのぼの楽しめて、でも熱くもなれる競走ゲームです。
視聴覚の魅力,-1,ゲーム自体は最高なのに
視聴覚の魅力,1,ふわふわと空中浮遊するプニプニを見たくて購入しました
視聴覚の魅力,1,見た目はカワイイ、ゆるふわなバトロワなので負けてもストレスは皆無です。
視聴覚の魅力,1,BGMも好き、かわいい
視聴覚の魅力,1,ゲーム自体は面白いです
視聴覚の魅力,1,GUYSが兎に角可愛い
視聴覚の魅力,1,面白いと思う
遊ぶ意義,1,ゲームをプレイすることは私にとって意味のあるものだと感じた。このゲームをプレイすることは私にとって価値があった。
遊ぶ意義,1,"クラウンを獲れたときの喜びや楽しかったことが今でも覚えている"
遊ぶ意義,1,ゲームはカジュアルに頭空っぽにしつつ、友達とワイワイできたり、一人で黙々と遊んでも楽しめる。また大人数でオンラインで同時につながって遊べているという独特の魅力があると感じた。
遊ぶ意義,1,遊ぶ価値は十分にあると思います
遊ぶ意義,1,遊ぶ意義を感じた
遊ぶ意義,1,作り手からの愛も感じます。小さいころボンバーマンが楽しくて仕方なかった頃の興奮が蘇ります。これからも新ステージが増えるかも知れないし、もっと面白く調整される可能性を秘めています。
遊ぶ意義,1,暇なときにちょこっとプレイする分にはとっても良いゲームだと感じました
遊ぶ意義,1,魅力のあるゲームだし、お金の無駄ってことはない
遊ぶ意義,1,"革新的で神ゲーに分類されるゲームであると思う"
遊ぶ意義,1,遊ぶ意義があると感じた
遊ぶ意義,1,ゲーム自体は本当に面白いです。だからこそこれから遊ぶユーザーはPS4版で遊んでほしい。
遊ぶ意義,1,このほのぼのとしたゲーム性がとても新鮮で楽しいです
遊ぶ意義,1,楽しさがわかってきた
遊ぶ意義,1,頭空っぽで童心に帰ったような根源的な楽しさがある
遊ぶ意義,1,ゲーム性自体は面白い。勝てるともっとやろう！という考えになる。キャラクターのかわいさ、クリエイティビティに富んだコース、高ランクコスチュームをゲットしようと夢中になれる要素がたくさんある。
遊ぶ意義,1,落ち込んでる時にゲームをやって元気になりたいそんな方達にオススメなゲームです
遊ぶ意義,1,気軽にたくさんのプレイヤーとわちゃわちゃしたいとか、可愛いゲームで癒されたいとか、そういう感じの方ならおすすめかもしれません。
遊ぶ意義,1,"勝敗以外のところで楽しませてくれた"
遊ぶ意義,1,ちょっと空いた時間に楽しんでいます
遊ぶ意義,1,遊びの要素が新シーズンごとに加えられるのが毎回楽しい
遊ぶ意義,1,人生でこんな素晴らしいゲームをプレイしたことは今までありませんでした
遊ぶ意義,1,ゲームは友達と盛り上がれるし経験を重ねると腕前が近くなり競いあうのが楽しいのですが
遊ぶ意義,1,このゲームをどう楽しむかはあなた次第。
遊ぶ意義,1,勝ち負け以外の、面白みや楽しみをしたいためにプレイしたい人
遊ぶ意義,1,負けても楽しめるゲームで、友達と一緒にプレイするとより楽しめる
遊ぶ意義,1,ゲームの中にあるガチゲーの感じが懐かしく、またハマってしまうくらい楽しいと感じた。
遊ぶ意義,1,非チーターでも楽しめるゲームであると感じた
遊ぶ意義,1,負けても精神的ダメージが少ないと感じた
遊ぶ意義,1,遊ぶ意義があった
遊ぶ意義,1,達成感は格別である
遊ぶ意義,1,遊ぶ価値のある作品であると評価しています
遊ぶ意義,1,勝ち負けなんてどうでもいいじゃないですか楽しければ
遊ぶ意義,1,大人から子供まで公平に楽しめるゲームで、心安らかに遊んでいると感じた
遊ぶ意義,1,やってて楽しいと思えたので評価を「おすすめします」に変更しました
遊ぶ意義,1,友達と遊ぶのはとても楽しいです
遊ぶ意義,1,普通に楽しい
遊ぶ意義,1,このゲームはとても癒されるし幸せな気分でプレイすることができる
遊ぶ意義,1,1位になったときの脳汁感は半端ないですね
遊ぶ意義,1,達成感のために何度もやってしまう
遊ぶ意義,1,遊ぶ意義を感じた
遊ぶ意義,1,将来性を感じることができる、面白くなっていくと思う
遊ぶ意義,1,"遊ぶ意義を感じた"
遊ぶ意義,1,楽しいゲームであり、愉快なゲームという表現が似合うので、有意義な体験であると感じた
遊ぶ意義,1,遊びやすく、気軽に楽しめるゲームだと感じた
没入感,1,私はゲームに夢中になった
没入感,1,プレイ中は周囲の状況に気付かなくなった。私はゲームに夢中になった。私は試合に完全に集中していた。
没入感,1,没入感があった
没入感,1,プレイ中は周囲の状況に気付かなくなった。私はゲームに夢中になった。私は試合に完全に集中していた。
没入感,1,声が出るほど面白い
没入感,1,負けても笑ったり、優勝した相手を称えたりと勝っても負けても楽しめる、そんな素敵なゲームです。
没入感,1,プレイ中は周囲の状況に気付かなくなった。私はゲームに夢中になった。私は試合に完全に集中していた。
没入感,1,気付いたら二十五時間くらいやってた
没入感,1,プレイしている間、俺はずっと笑顔だった
没入感,1,私はゲームに夢中になった
没入感,1,プレイ中は周囲の状況に気付かなくなった。私はゲームに夢中になった。私は試合に完全に集中していた。
没入感,1,私はゲームに夢中になった
没入感,-1,"プレイ中は周囲の状況に気付かなくなった"
没入感,1,ドキドキがある
没入感,1,アタマおかしくなる面白さがある
没入感,1,プレイしても見ていても楽しくて運動会のような気分でプレイできます
没入感,1,私は楽しんでできた。ストイックにゲームをすすめられたのならば、君は確実に成長する。
没入感,1,何時間でもやってられる
没入感,1,自分でも驚くほどはまってます
没入感,1,あっという間に2時間超えます
没入感,1,心臓バクバクなっても、見られてるかもと思うと頑張ったりするのかもね
没入感,1,楽しくてやりまくった
没入感,1,数時間ぶっ通しで遊んでいた
没入感,1,游戏让我心跳加速，血压升高，泪流满面，痛哭流涕
没入感,1,没入感があった
没入感,1,私はゲームに夢中になった
没入感,1,私はこのゲームに夢中になった
没入感,1,ついつい熱中してしまう作品です
没入感,1,プレイ中はのんびり笑いながら出来た
没入感,1,気が付いたらやりこんでたくらいにはハマる
没入感,1,engancha mucho
没入感,1,少しの失敗なら挽回できる内容、程よい刺激と緊張で楽しめます
没入感,1,Oynarken kahkalar atıyorum
没入感,1,ついついやってしまいます
没入感,1,久しぶりにゲーム中に声が出てしまった
没入感,1,適度にハラハラするので、ストレス解消になる
没入感,1,ゲーム自体は頭を空にして楽しめる
没入感,0,周囲の状況に気付かなくなった
没入感,1,You forget what reality is
没入感,1,プレイ中は周囲の状況に気付かなくなった。私はゲームに夢中になった。
没入感,-1,後半になればなるほど精神状態はバトルロワイヤルのそれに近くなる
没入感,-1,勝ち抜いたファイナルラウンドで本性を現したチーターに全て台無しにされる
没入感,-1,プレイ中は周囲の状況に気付かなくなった
没入感,-1,なかなか思うように進めない
没入感,1,プレイ中に友達と遊ぶともっと楽しさを感じた
没入感,-1,見ていた以上に触ってみるとこれが実に難しくてもどかしい
没入感,1,病み付きになり延々と遊んでしまうゲーム
没入感,-1,プレイ中は周囲の状況に気付かなくなった
没入感,1,楽しく遊べるようになりました
没入感,1,ソロでも時間を忘れてプレイできる
成長感の得やすさ,1,ゲームが苦手でもチーム戦なら上手い人に乗っかって優勝できる可能性があります。初心者でゲームが苦手な方は少しキツかもしれません。
成長感の得やすさ,1,レースは数種類ステージがあり、何回もやっているとコツが掴めてきた。
成長感の得やすさ,1,やって覚えたほうが上達は速いですっｗ ゲームを楽しんでいれば勝手に上手くなります
成長感の得やすさ,1,腕を磨いて差が付くようになるのも楽しかろうと思う
成長感の得やすさ,1,私はこのゲームをうまくプレイできると感じた。ゲームをプレイしながら能力を感じた。このゲームをプレイして、熟練した感覚を感じた。
成長感の得やすさ,1,初めてすぐに優勝とはいかないけれど、お目当てのコスチュームがショップに出現するのを待ちながらプレイしているといつの間にか決勝常連になってるぐらいにはとっつきやすいゲームだと思います
成長感の得やすさ,1,やりやすくなって、さらに楽しいですよ
成長感の得やすさ,1,リワード解放もそこまで難しくない
成長感の得やすさ,1,覚えることも少なく、ステージが変わってもとにかく頑張ればなんとかなる感じ
成長感の得やすさ,1,ポイントが貯まってスキン等が解放されていく
成長感の得やすさ,-1,ある程度のテクニックが必要になってくると思います
成長感の得やすさ,1,1位たくさんとれたので満足してます
成長感の得やすさ,1,己の技を磨き、勝利を勝ち取るのみ。挫けてはいけない。その悔しさは血となり、肉となる。
成長感の得やすさ,1,コツ覚えたり近道見つけたりするのにもってこいの場所です個人的に
成長感の得やすさ,1,遊んでいくたびに己のスキルがどんどん磨かれていくのを実感します。
成長感の得やすさ,-1,上手くなるほど虚しくなる
成長感の得やすさ,1,かわいいスキンが日替わりにショップに並ぶので稼ぐために一生懸命プレイしてうまくなれる。シーズン3から参加して100時間超えた辺りからやっと優勝できるようになりました。長かった…。
成長感の得やすさ,1,勝ってランクが上がるからもっと腕を磨こうと回数をこなすような感じ。
成長感の得やすさ,1,さほど実力がない私でも、数回に一度ぐらいは脳内で優勝してます
成長感の得やすさ,0,買ってすぐに実践でやってれば少しずつコツを掴めては来ますが
成長感の得やすさ,-1,自分はアクションゲームは得意な方だと思っていたが10時間遊んでいるのに1位を取れたことがない
成長感の得やすさ,1,遊んで得意になればいいんだよ！
成長感の得やすさ,1,実力が無くても勝ち進めます
成長感の得やすさ,1,初心者でもゲームに勝てないから王冠が手に入らないということはない
成長感の得やすさ,1,ちょっとしたコツを掴むだけでステージのクリア率が上がる
成長感の得やすさ,1,プレイヤースキル要求はそんなになくて、誰でもやってれば勝てる
成長感の得やすさ,1,慣れたらたくさん勝てるようになる
成長感の得やすさ,1,気軽に遊べて達成感も味わえる
成長感の得やすさ,-1,リアルプレイヤースキルが問われるので、やりこんでる人に勝つには相当練習が必要
成長感の得やすさ,1,君は確実に成長する。最後の１人になるには努力と運が必要となる。少しずつ上達もするだろう。
成長感の得やすさ,1,勝てるようになってくるとより楽しくなってきます
成長感の得やすさ,-1,下手なアクションゲーマーはかなり優勝は厳しいゲーム
成長感の得やすさ,1,最高ランク到達簡単
成長感の得やすさ,1,優勝しなくたって、クラウンランクが上がり金装備をｇｅｔできます。
成長感の得やすさ,1,勝つだけなら簡単にできる
成長感の得やすさ,-1,技量が上がっていきやすい序盤だけは面白いと思いますが、慣れてくるとすぐ高ランク帯に入れられるのでそこでなお勝てる技量がつくまで修行のようになってしまいます。
成長感の得やすさ,1,ACTが上手いとは言えない子供もでも10回に1回くらいは1桁まで残れます(最高位last3)
成長感の得やすさ,0,历练了我的心态
成長感の得やすさ,-1,プレイを重ねる毎に自分の成長を感じたい人はすぐに飽きる
成長感の得やすさ,1,操作に慣れて、ミニゲームに何とか勝利できた時は爽快感を味わうことができました！
成長感の得やすさ,1,場数を踏むことで誰でも上手くなれると思う
成長感の得やすさ,1,コツもつかみやすいのでカジュアルに楽しむことができると思います
成長感の得やすさ,1,スキルと根気次第ではなんとかなると思う
成長感の得やすさ,1,ゲーム下手の私でもゲームパッドで気軽に参加することが出来ました
成長感の得やすさ,1,負けても、わー、今度は負けないぞーとは思っても、イライラしません。何ならやってるうちにちょっと出来るようになってきます。
成長感の得やすさ,1,何度かやっていくうちにできるようになってきてゴールできた時には謎の感動がありました
成長感の得やすさ,1,テクニックはあれど、基本はゲーム初心者でも軽い説明で楽しくプレイすることができる
成長感の得やすさ,-1,私は非常に悪いため、勝てる感覚は得られなかった
成長感の得やすさ,1,クラウン取れたときの達成感
成長感の得やすさ,1,ある程度の操作が可能になれば、知識と運で優勝も可能になる
成長感の得やすさ,1,初心者の方にもおすすめです
成長感の得やすさ,1,練習による上達もわかりやすく、すぐに実感できます
成長感の得やすさ,-1,実力はそれなりに必要ですが、割と運要素が多い気がするゲームで
成長感の得やすさ,1,簡単に始められるが、意外と奥が深い
成長感の得やすさ,1,Easy to learn / Hard to master
成長感の得やすさ,1,ゲームをやるにあたっての障壁が極めて低く誰でも簡単にプレイできます
成長感の得やすさ,1,負ければ負けるほど、勝てないミニゲームで勝てたときは最高に楽しい
成長感の得やすさ,1,初心者でもゴールできるのでいつでも気軽に新規で始められそう
成長感の得やすさ,1,頑張れば誰でもクリアできると感じた
成長感の得やすさ,1,私もレベル２５付近に到達してやっと優勝できたので、諦めなければいつか必ず優勝できます。
成長感の得やすさ,1,誰でも楽しめます。プロゲーマーでも苦戦するみたいですが、自称プロのわたしも苦戦
成長感の得やすさ,1,ようやく初優勝できた
成長感の得やすさ,1,ゲームが簡単すぎないのも良いポイントだと思います
成長感の得やすさ,1,流れが良ければプレイ時間３時間程度の自分のような初心者でも優勝できる
成長感の得やすさ,0,動画とか配信とかみて自分の方がうまくできそうだな。とか思ってたけど全然ダメでした。ウケる。
成長感の得やすさ,1,ゲームプレイはものすごく簡単で他のバトルロイヤル系のゲームに比べエイム精度などの難しい技術が問われないため、良いと思います
成長感の得やすさ,0,まだ王冠一個しか取れていないのでがんばりたい
好奇心への刺激,1,プレイヤーの戦法も日進月歩で変わっていくのでそれらの対応策を考えていくのも楽しいです
好奇心への刺激,0,ミニゲームがどのように進化するかを知りたかった。シーズン2がやりたくなるかどうかが微妙に感じた。
好奇心への刺激,0,メンテが開けるとどうなる？
好奇心への刺激,0,どういう世界が待っているのかは想像できません
好奇心への刺激,0,興味があったけど、チーターの件で敬遠していたという場合は、検討の余地ありだと思います
好奇心への刺激,1,更新されたんだちょっと遊んでみよう
好奇心への刺激,1,攻略法を知ること、発見することが何よりも重要となる。
好奇心への刺激,1,収集欲が促進される
好奇心への刺激,1,新ステージが出ることに興味を持った
好奇心への刺激,1,新シーズンの情報なども出てきてまだまだ人気は続きそうです
