aspect,np,review
操作のしやすさ,1,説明がわかりやくなって助かります
操作のしやすさ,0,ガイズくんの操作はキーボード&マウスか、コントローラーで行います。カメラの操作も必要なのですが、マウスだと微調整が難しいのでコントローラーで遊ぶことをおすすめします。あとキーボード操作だとガイズくんが走り出したときの初速が遅く感じます。
操作のしやすさ,1,走る、掴む、よじ登る、ジャンプする、飛び込むしかアクションがないため、ゲームが苦手な人でもそこそこ楽しめるでしょう。
操作のしやすさ,1,とっつきやすいゲームだと思います
操作のしやすさ,1,"やりやすくなって、さらに楽しいですよ！"
操作のしやすさ,1,基本的な操作は簡単で歩く、ジャンプ、つかむ、それだけ。覚えることも少なく、ステージが変わってもとにかく頑張ればなんとかなる感じ。
操作のしやすさ,1,コントローラーを使った方がやりやすいぞい
操作のしやすさ,1,キーボード&マウスでもプレイできますが、細かな操作が出来ないためSteam版でもコントローラーを接続してプレイすることをオススメします。自分も最初はキーボード&マウスでプレイしていましたが、狙ったところに着地したり、視点変更にやりづらさを感じ、現在はXboxOneコントローラーでプレイしています。
操作のしやすさ,1,遊び方に困ることはないはず。
操作のしやすさ,1,直観的に遊べるゲームなので特に気になる点ではないとは思いますが
操作のしやすさ,-1,操作は移動、ジャンプ、掴むとシンプルで見た目のゆるさやブロードキャストでは簡単そうじゃん！と見くびっているとふらふらふにゃふにゃキャラの動きにかなり苦戦する。ただコントローラーのボタン配置がXBOX基準なのでちょっとやりづらかった。
操作のしやすさ,1,簡単な操作で気軽に遊べて負けたり妨害されてもキャラクターの可愛さであまりイライラせずプレイ出来ています
操作のしやすさ,1,冗長さと軽快さの黄金比率のような操作性で快適に遊べ
操作のしやすさ,1,単純な操作なのでアクションが苦手でも楽しめる
操作のしやすさ,1,基本の操作は移動とジャンプとつかみとダイブ、簡単操作で初心者にもとっつきやすい。感覚的に理解しやすいゲームが多く、ルールを理解しやすい。
操作のしやすさ,-1,操作が悪くなってる気がする。何もないところで転ぶようになった。
操作のしやすさ,1,ロード時間の説明分を読めば誰でも理解できる簡単なルールのゲームばかりで誰でも遊べるバトロワゲームです
操作のしやすさ,1,シンプルな操作とルールでいつでも気軽にできる
操作のしやすさ,-1,移動やつかみのラグの影響が凄いです
操作のしやすさ,1,"操作もルールもシンプルで気軽に遊べると思います。「ジャンプ」「飛び込む」「つかむ」の3つの動作をうまく使ってゴールを目指しましょう！"
操作のしやすさ,1,操作が簡単だった
操作のしやすさ,1,操作は単純ですがなかなかに難しく、楽しいです。十分操作できています。
操作のしやすさ,1,操作がシンプルなので経験とプレイヤースキル（状況判断・事前予測）が左右される
操作のしやすさ,1,操作性などは抜群に良い
操作のしやすさ,1,"ルールもシンプルで感覚でわかるのでやりやすいです。"
操作のしやすさ,-1,正しい床を見つけてゴールを目指すマップにて、オレンジタイルの段差に引っかかる所為かとにかく滑って落ちまくり、ゴールにたどり着くどころかタイルの上に乗ることすらままならない状態です。
操作のしやすさ,1,操作が簡単なのでゲームが苦手な人にもお勧めです
操作のしやすさ,1,"操作方法自体は本当に単純で、出されたお題に対して走る、飛ぶ、掴むのアクションで他人よりも長く生き残るか先にゴールするか。ルール自体がわからないという問題には当たりにくい  "
操作のしやすさ,1,パソコンでゲームしてた方なら簡単に始めれます。
操作のしやすさ,1,"単純なルールでシンプル判りやすい。お年寄りとお孫さんでも遊べるのはうれしい。  "
操作のしやすさ,-1,ゲーム画面のカーソルが荒ぶって選択が中々行きません
操作のしやすさ,1,英語が読めなくても判り易いルールに多くないボタン操作
操作のしやすさ,1,操作がシンプルで、回転が速いので、ちょっとやりたい方も、じっくりやりたい方も楽しめると思います。
操作のしやすさ,1,キャラクターが見た目の通りよく転ぶので、良い意味で操作性が悪くてアクションゲームの腕前の差が出にくいところが対戦ゲームとして良い
操作のしやすさ,1,操作性が良い　問題なく、自分の操作したい方向に動かせる。
操作のしやすさ,1,誰でもすぐに遊べて必要な経験などは殆ど要らない
操作のしやすさ,1,どれもぱっと見でルールが分かるものがほとんどなので困ることはないでしょう
操作のしやすさ,1,操作に関しても至ってシンプル 移動とジャンプ、距離稼ぎのヘッドスライディングに他プレイヤーを邪魔するための掴みだけです。
操作のしやすさ,1,"操作に慣れて、ミニゲームに何とか勝利できた時は爽快感を味わうことができました！"
操作のしやすさ,-1,パッドでやってると問題なくゲームができるけど、未だにマウスでやるとカーソルを動かしてるとき画面が停止してしまいます。
操作のしやすさ,1,難しい操作がなく簡単
操作のしやすさ,1,"移動、ジャンプ、飛び込みダイブ、つかみと操作はシンプルなのでとっつきやすいです。 "
操作のしやすさ,0,操作も非常に単純で、例えキャラコンに自信があったとしても最初のスタート位置、巻き込まれ、事故などの運が半分くらい絡んでくるので勝つとは限りません。
操作のしやすさ,0,実技的なチュートリアル機能or練習機能があると初見でとっかかりやすいかなと思うので要望として記載しておきます
操作のしやすさ,1,ゲーム下手の私でもゲームパッドで気軽に参加することが出来ました
操作のしやすさ,1,操作も簡単で楽しくてカワイイ
操作のしやすさ,1,操作に慣れればほかのゲームにも応用できる気がしています
操作のしやすさ,1,基本はゲーム初心者でも軽い説明で楽しくプレイすることができるので
操作のしやすさ,1,とてもラグもなくサクサクとできて面白いと思いますが
操作のしやすさ,0,キーボード＆マウスだとキャラクター操作が難しいが、慣れれば楽です
操作のしやすさ,-1,マウスのボタンを操作に割り当てられず不便。
操作のしやすさ,1,操作も簡単で一戦も一戦が短く気軽に出来るのも重要です。操作も簡単、プレイも短い。
操作のしやすさ,1,カジュアルな操作感（移動・ジャンプ・ダイブ・掴み・エモート）
操作のしやすさ,1,操作がシンプルで分かりやすく誰でも気軽に始められるのがとても良いです。
操作のしやすさ,1,練習による上達もわかりやすく、すぐに実感できます
操作のしやすさ,0,操作に若干精密性が求められるのでコントローラー推奨です
操作のしやすさ,1,"操作も簡単"
操作のしやすさ,1,操作も簡単（ジャンプ、ダイブ、掴む くらいしかない）なので
操作のしやすさ,1,操作は非常に簡単だが、微妙な動作制御やダイブのタイミングなどで上手さが出る
操作のしやすさ,1,ゲームをやるにあたっての障壁が極めて低く誰でも簡単にプレイできます。うちの母親でも大丈夫。しかもゲームデザインは可愛い傾向にあるので見た面的な障壁もほとんどありません。
操作のしやすさ,1,お手軽操作です！
操作のしやすさ,1,ルールはシンプルなので言語は関係ない。使用するアクションもジャンプ、掴む、登るの３つのみ。
操作のしやすさ,1,操作はシンプルで基本は個々の順位をひたすら競うミニゲームゲー、どのステージ構成もだいたい一回やればわかるので出遅れも気にしなくて良いんじゃないかな
操作のしやすさ,1,ゲームパッドの方が各段にプレーが楽になり操作も正確に行えます
操作のしやすさ,1,ほぼ頭使わないし気軽に出来る
操作のしやすさ,1,ルールもわかりやすく全体的に好印象
操作のしやすさ,1,ゲームプレイはものすごく簡単で他のバトルロイヤル系のゲームに比べエイム精度などの難しい技術が問われないため、良いと思います。
操作のしやすさ,1,気軽に遊べる
難易度の適切さ,1,程よい運ゲー要素でプロ級プレイヤーもそれなりに落とせたり
難易度の適切さ,-1,初心者でゲームが苦手な方は少しキツかもしれません。
難易度の適切さ,-1,最近強いガイズくんが増えてきましたが、ランク分けなどのシステムが発売から1年以上経っても無く上手なガイズくんも初心者のガイズくんも同じ部屋にマッチングしてしまうので、最初はなかなか決勝戦に行くことすら難しいと思います。
難易度の適切さ,1,上位に入るのが安定するようになればそうそうふるい落とされない
難易度の適切さ,1,自分がどうプレイしていくかを重点に考えて挑んでいくと1位も自然と取れたりして、飽きずに楽しく続けられると思います！
難易度の適切さ,1,初めてすぐに優勝とはいかないけれど、決勝常連になってるぐらい
難易度の適切さ,0,ゲームは運の要素もあり、苦手ステージで落選することがあるが、難しすぎないと感じた。
難易度の適切さ,0,"少し歯ごたえがある６ステージがやってきました。"
難易度の適切さ,-1,プレイヤーのレベルが上がりすぎて初心者に勝つのはほぼムリゲー
難易度の適切さ,1,リワード解放もそこまで難しくない
難易度の適切さ,1,クリアできなくてもイライラすることのないゲームでした。
難易度の適切さ,-1,新シーズンのMAPほど複雑なギミック等が用意されており、初見では理解できなかったりそこそこ精密なキャラ操作を要求される。
難易度の適切さ,-1,週末などの夜間は猛者や初期からやってるベテラン勢が多いのでクリアしにくい
難易度の適切さ,1,ファイナルステージまで勝ち残るにはある程度のテクニックが必要になってくると思います。
難易度の適切さ,1,難易度がちょうど良かった
難易度の適切さ,0,難易度: 易い～普通
難易度の適切さ,1,単純なように見えて物量の壁があるので意外に運と技量が必要で競技性がある。
難易度の適切さ,1,遊んでいくたびに己のスキルがどんどん磨かれていくのを実感します。もちろん運やチーム戦、ケアレスミスで負けてしまってストレスを感じる事もありますが、負けても笑ったり、優勝した相手を称えたりと勝っても負けても楽しめる、そんな素敵なゲームです
難易度の適切さ,0,慣れないうちは仕掛けやヤクモノにふっとばされたりあらぬ方向へキャラが飛んで行ったりして早々に脱落してしまうかもしれないが、時にはちょっと立ち止まって先に行くライバル達の動きを見るのも良いかも。
難易度の適切さ,-1,難易度が高く感じた
難易度の適切さ,-1,飽きないことはないんだけどかわいいスキンが日替わりにショップに並ぶので稼ぐために一生懸命プレイしてうまくなれる。
難易度の適切さ,-1,何回かプレイするとイライラする。
難易度の適切さ,-1,ランク分けはされていないため、初心者とガチ猛者が混ざってしまっていることで、初心者は運でもない限りは勝てない。
難易度の適切さ,-1,ほぼ運ゲーで反射のようなプレイヤースキルは皆無
難易度の適切さ,-1,ファイナルステージはほぼ運要素
難易度の適切さ,-1,最終戦に残るのは結構ハードルが低いが、1位は段違いに難しい
難易度の適切さ,1,自分はアクションゲームは得意な方だと思っていたが10時間遊んでいるのに1位を取れたことがない。難易度は非常に高いように思う
難易度の適切さ,1,運も実力も必要ですが、そこが面白いです
難易度の適切さ,0,初心者でもクリアできるくらいの変化を希望する。たまに「これ初心者クリアできるのか」という変化があったりする。
難易度の適切さ,1,意外にゴリゴリのベテランに負けてばかりってことはないので初心者さんも安心して始められます
難易度の適切さ,-1,初心者は勝てないと感じた
難易度の適切さ,-1,最後の一人になるまで勝ち残るのは結構難しい
難易度の適切さ,1,プレイヤースキル要求はそんなになくて、誰でもやってれば勝てる。
難易度の適切さ,1,特にストレスなく遊べます
難易度の適切さ,-1,コースもかけ離れ過ぎてクリアすらできない人数が多発
難易度の適切さ,-1,ラウンドが進むにつれてシビアな動きを求められる
難易度の適切さ,-1,その分リアルプレイヤースキルが問われるので、やりこんでる人に勝つには相当練習が必要
難易度の適切さ,1,勝つためには攻略法を知ること、発見することが何よりも重要となる
難易度の適切さ,1,運と実力の絶妙なバランス
難易度の適切さ,1,運要素もありますが、結構テクニック求められるので、勝てるようになってくるとより楽しくなってきます。fainalステージは新旧問わずテクニックの要求値が間違いなく上がっている気がするので、初めてすぐの人が王冠とれる可能性は限りなく少ないと思います。
難易度の適切さ,-1,ただしアクションゲームとしては結構難しめ
難易度の適切さ,0,スキルが必要なかった
難易度の適切さ,1,初めはマウス・キーボードでしたが、かなり難しく、楽しいです。
難易度の適切さ,1,シーズン名誉ランクも一日30分程度のプレイを続けてればラクラク最高ランク到達簡単
難易度の適切さ,0,うまい人は本当にうまい（自分は下手）
難易度の適切さ,-1,無駄に複雑で上級者のみが楽しめるデザインは今後先細りしていかないか
難易度の適切さ,1,対人ゲー弱小プレイヤーも多く勝つだけなら簡単にできる
難易度の適切さ,-1,一部の人がバグが原因で難易度が跳ね上がっているという今の状況は、正直良い事だとは思いません。
難易度の適切さ,-1,"1位を取るハードルが極めて高い上に運要素も多分に含まれるため、競争意識の強い人間には非常にストレスが溜まる  "
難易度の適切さ,0,慣れてくるとすぐ高ランク帯に入れられるのでそこでなお勝てる技量がつくまで修行のようになってしまいます
難易度の適切さ,-1,"当たった事のないゲームでストレスが溜まったり、クリアできずイライラする事もちょいちょいあります。  "
難易度の適切さ,-1,難易度はプレイヤーにとって苦しいと感じる部分がある
難易度の適切さ,1,平等なキャラ性能、多少の失敗でも十分取り返せる緩めの生き残りライン
難易度の適切さ,-1,めっちゃ難しい。
難易度の適切さ,-1,"実力６割　運４割といったゲームです"
難易度の適切さ,-1,初心者が勝つのは厳しい状況がある
難易度の適切さ,-1,難しくなっている印象
難易度の適切さ,1,簡単なミニゲームがたくさんあり
難易度の適切さ,1,初心者でも障害物競走的なステージは楽しめている
難易度の適切さ,1,ゲームはほとんど勝てないが、諦めて次のラウンド行こうと気持ちを切り替えられる
難易度の適切さ,1,難しいゲームはなく場数を踏むことで誰でも上手くなれると思う
難易度の適切さ,-1,アスレチックが鬼畜ですが
難易度の適切さ,0,容易破防
難易度の適切さ,1,"ゲーム性はシンプルながら、1位になるにはそれなりにテクニックや運が必要になるので、一筋縄ではいかない難易度です。 "
難易度の適切さ,0,理不尽だけどあきらめず頑張れば優勝を狙える微妙なライン
難易度の適切さ,1,FPS苦手勢、アクションあんまり得意じゃない、むしろ苦手な方かも……という人の方が、ストレスなく楽しく遊べる点だと思います。
難易度の適切さ,-1,初心者は猛者を前には一位を取るのが大変難しいです。
難易度の適切さ,-1,おそらく一番1位取るのが難しいゲーム
難易度の適切さ,1,少しの失敗なら挽回できる内容、程よい刺激と緊張で楽しめます
難易度の適切さ,-1,難易度が私には難しかった
難易度の適切さ,1,結構ムズかしいですがゲーム自体が楽しい
難易度の適切さ,-1,これから始めようとする人が1位を取るのは相当厳しいかもしれません。
難易度の適切さ,-1,このゲームで最も重要な要素は運で、運の前に操作技術や立ち回り等全て踏みにじらされる理不尽さを何度も味わされることになる
難易度の適切さ,1,ある程度の操作が可能になれば、知識と運で優勝も可能になる。
難易度の適切さ,1,シーズン２を前に各ステージのギミック追加や配置・動作などがランダムになったりして以前よりも少し難易度が上がったけど、その分楽しくなっています。
難易度の適切さ,1,初心者の方にもおすすめです。
難易度の適切さ,1,若干難易度が上がったような気がします。楽しいです。
難易度の適切さ,0,ちょっとした変化でゲーム性や難易度がガラっと変わり
難易度の適切さ,-1,実力はそれなりに必要ですが、割と運要素が多い気がするゲームで
難易度の適切さ,1,最終ラウンドまで上位%で評価されるため、中盤で脱落しても「ここまでこれたなら合格でしょ！」という気持ちになれます
難易度の適切さ,1,Easy to learn / Hard to master
難易度の適切さ,1,緩いので負けてもストレスは感じないです
難易度の適切さ,1,一部の確率論面とスターティンググリッドの位置で難易度の激変する面を除いては意外にも純粋なプレイヤースキルが試される場面が多いのでそのへんは意外に硬派。
難易度の適切さ,1,負けても次の試合をやってしまうくらいのちょうど良い難易度
難易度の適切さ,1,運とタイミングさえ合えば初心者でもゴールできるのでいつでも気軽に新規で始められそう。
難易度の適切さ,1,運と実力のバランスがちょうどよく、頑張れば誰でもクリアできるがスキルが全く関係ないというわけでもないため、何回でも繰り返しプレイしてしまう中毒性があります。
難易度の適切さ,0,気軽に何度もプレイできるが、優勝するのがとても難しい
難易度の適切さ,0,運だけで優勝することもあるみたいですが、やはりプレイ時間がものを言うと思います。
難易度の適切さ,1,１位になるのは相当な腕前じゃないと無理な気がするけど、誰でも楽しめます。プロゲーマーでも苦戦するみたいですが、自称プロのわたしも苦戦。見ていた以上に触ってみるとこれが実に難しくてもどかしい。逆に歯ごたえがあって長い時間遊べそうです。
難易度の適切さ,0,テクニック的なものはあるにはあるのだが、単独では決して超えられない運的な要素が介在する
難易度の適切さ,1,ゲームは簡単すぎず、難しすぎなかった
難易度の適切さ,1,ゲームが簡単すぎないのも良いポイントだと思います。
難易度の適切さ,-1,アクションが凄く苦手な人には敷居が高そうということ
難易度の適切さ,1,流れが悪ければ初戦敗退するし、流れが良ければプレイ時間３時間程度の自分のような初心者でも優勝できる
難易度の適切さ,-1,勝てないと面白くないゲーム
難易度の適切さ,1,いい塩梅だね
難易度の適切さ,-1,個人戦では勝負にすらならない
難易度の適切さ,-1,初ドン勝までが本当に遠くて辛かった
難易度の適切さ,-1,一部の試合形式はそれなり理不尽だったり
難易度の適切さ,-1,難しいけど、勝てない
進捗の明確さ,1,ゴールできた時には謎の感動がありました
進捗の明確さ,1,ROUND CLEAR!とでた
進捗の明確さ,1,達成感のために何度もやってしまう
目的の明確さ,1,ゲームの目的は私には明らかだった
目的の明確さ,1,他者を出し抜き１位になるのがこのゲームの目的なのだから当然だ
目的の明確さ,1,ゲーム内の主な目的になります
目的の明確さ,1,パーティを組んでいる人が優勝するために注意すべきことが明確だった
目的の明確さ,1,基本的なルールとしては〇トップを目指してコースを走破する『レース』〇各陣営にわかれて争う『チーム戦』〇規定人数が脱落するまで生き残りを目指す『サバイバル』があります
目的の明確さ,-1,ルールが良くわからずに十分に楽しめない
目的の明確さ,-1,１位を取る！という目的を持つのではなく
目的の明確さ,1,"それぞれの種目も、数回やればどのようなルールかわかるようになっています。 "
目的の明確さ,1,シンプルなルール
目的の明確さ,-1,最終的にはクラウン集めがメインになるので何か目標か楽しみを見つけられない
視聴覚の魅力,1,ポップなキャラクターにクセになる音楽
視聴覚の魅力,1,ゲームのスタイルが気に入った
視聴覚の魅力,1,雰囲気は良かったことを今でも覚えています。
視聴覚の魅力,1,ゲームは、カジュアルに頭空っぽにしつつ、友達とワイワイできたり、一人で黙々と遊んでも楽しめる、また大人数でオンラインで同時につながって遊べているっていうポイントが1つのポイントだと思います。
視聴覚の魅力,1,エモートや馴れ合いがとても楽しいゲームです！ステージのゴール前でWooWooWooWoo~と手を振って挨拶したりｺｹｺｹｺｹｺｹｺｰと鶏のものまねエモートをしているガイズくんが可愛くてとても癒やされます。たまに知らないガイズくんが一緒にエモートをしてくれるときもあります。
視聴覚の魅力,1,デフォルメされてて見た目はゆるい思うけど中身は完全ガチガチのデスゲームなのでギャップに震えろ
視聴覚の魅力,1,衝撃的な展開に充ち溢れすぎていて、予期せず爆笑こいたりします
視聴覚の魅力,0,見た目(だけ)はかわいいバトルロワイヤル
視聴覚の魅力,1,ゲームに魅力があり、お金の無駄ではないと感じた。
視聴覚の魅力,1,ゲーム自体は面白く、「これはハマってしまうかな」と思っていた
視聴覚の魅力,1,キャラクターがとにかくいいです。笑いが出るだけで怒りにはならない。
視聴覚の魅力,1,負けても笑い飛ばせるリアクションができる
