aspect,review
操作のしやすさ,操作感が非常に良く、爽快なアクションが楽しめるゲームで、難易度も調整可能。親切なチュートリアルがあり、初心者でも気軽にプレイできる。UIやカメラの設定も柔軟で、スタイリッシュな戦闘が実現されている。一方で、キーボードとマウスでの操作は難があり、コントローラー推奨との声もある。全体として、アクションが苦手でも楽しめる作品だ。
難易度の適切さ,このゲームは爽快感のあるアクションRPGで、適切な難易度設定があり誰でも楽しめる。ノーマルで進めるとストーリーを楽しめるが、ハードにすると一撃でやられることも。イージーモードやオート機能があり、アクションが苦手な人でも安心してプレイできる設計になっている。難易度を途中で変更可能で、ライトユーザー向けの配慮もされている。
進捗の明確さ,エンディングでメッセージが表示され、セーブデータにマークがつく。難解なストーリーだが、Eエンドに進むにつれて情報が得られ、順調に進行できる。達成感が大きい。
目的の明確さ,ストーリーを楽しむことが主目的で、全体としての一貫したストーリー展開がある。マップでのナビゲーションは優れているが、ストーリーや設定が薄く説明不足が目立つ。感情や葛藤を描写する部分には感動があるが、目的地の明示や情報提供には改善の余地がある。
視聴覚の魅力,全てが高水準で丁寧に調和されたアクションシューティングRPG。美しいグラフィックや独創的な音楽、魅力的なキャラクターが特徴で、ストーリーも深い。特にBGMが素晴らしく、サウンドが臨場感を生み出している。探索やクエストも楽しめ、多くのプレイヤーにお勧めできる作品である。
遊ぶ意義,このゲームは私にとってとても意義深く、ストーリーや世界観に深く感情移入できた。プレイ中は時が経つのも忘れ、様々なテーマについて考えさせられた。特にエンディングに感動し、満足感があった。アクションゲームとしての爽快感もあり、全体的に非常にお勧めできる作品だと感じた。
没入感,ゲームに夢中になり、ストーリーやキャラクターに引き込まれた。没入感のある音楽やグラフィック、シンプルで機能的なUIが秀逸で、プレイ中は時間を忘れ、周囲に気付かないほど楽しんだ。感情移入が強く、涙を流しつつも、サクサク進むストーリーに没頭できたことが印象的だった。
成長感の得やすさ,ゲームの進行とともに戦闘が楽しくなり、熟練感を実感できる。レベルアップや装備強化で爽快感もあり、初心者でも楽しめる設計。ゲーム操作が苦手でも問題なく進め、成長を感じやすいが、慣れると戦闘が単調に感じることも。全体的には親切な作りでプレイしやすい。
好奇心への刺激,ゲームの進化や複数のエンディングに魅力を感じ、周回するごとに新たな発見がある。やりこみ要素豊富で、サブクエや伏線が後の理解に繋がる。ストーリーが深く、前作をプレイするとさらに楽しめる。様々な要素が絡み合い、興味を持ち続けられるゲーム体験を提供している。
自由度,ゲームは自由度が高く、プレイスタイルや難易度を自由に変更できる点が魅力。オープンワールド的な要素ややり込み要素も楽しめるが、移動の自由度やキャラクター選択に制限がある部分もあり、探索の幅は狭い。ストーリーやモードの選択肢が豊富で、個々の楽しみ方ができる良質なゲーム。
