aspect,np,review自由度,1,最初のスポーンの飛び降りるタイミングは自分で選べるため降りたくない場所におろされることはない
自由度,1,特攻隊員のような遊び方に切り替えるのがおすすめだ
自由度,1,自分の楽しみ方を見つけよう
自由度,1,自分のやり方で自由にゲームをプレイできた
自由度,1,一人で楽しむもよし！友達と一緒にやるもよし！
自由度,1,武器やアタッチメント、服装を選べる自由がある
自由度,1,武器の種類が多いのとパルスの位置で立ち回りを変えたり戦略を楽しめる、車などに乗ったり草に隠れることもできるのでアクティブに動いたりステルスに行動ができる
自由度,1,敵の後ろから弾を叩き込んで物資をぶんどりつつ、必要とあらば建物の中でひたすらキャンプし、泥だらけになりながら小麦畑を這いずり回る
自由度,1,撃ち合いだけじゃなく立ち回りも重要なので、ずっと銃を撃たずに隠れまわったり、敵プレイヤーが安全地帯にたどり着かず勝手に死ぬのを待ったら1位になる事もある
自由度,1,平等さが素晴らしい
自由度,1,自由な選択を実現するスカイダイビングスタート。好きな装備を集めて実家のような安心感。別に戦わなくて良い（一方的に撃つ撃たれる日常茶飯事）。1人が寂しいならペア戦や4人小隊戦。
自由度,1,ソロモード・2人モード・4人モードと参加人数によって分かれているのがとても良い。
自由度,0,アタッチメントは種類が多く、当たり前だけど勝手にはついてくれないので、多少調べる必要がある。
自由度,1,ガンガン攻めてもよし、じっくりプレイしても良しです。
自由度,1,勝ち負けに拘らず友達とわいわいしたい方には自由に楽しめるだろう
自由度,1,次行ってみよーと気持ちを切り替えやすい作りになっている
自由度,1,自分のやり方で自由にゲームをプレイできた
自由度,1,1人でもプレイでき最大4人と一緒に遊ぶことができます
自由度,1,色々なプレイスタイルが出来る。ステルスして行くのも良し。相手を倒すプレイングも良し。装備をひたすら集めて最強を目指すのも良し。
自由度,1,自由度が高く、「逃げる車のタイヤを撃ちパンクさせる」「ドアをショットガンで破壊し隙間からグレネードを投げる」、また製品版より可能になったパルクールによる奇襲等のプレーも可能。
自由度,1,移動の時も視点変更可能です。
自由度,1,自分でもやってみたいと思った人のためのものだと思っている
自由度,1,ゲーム自体は面白く、マップも広いし皆でやると楽しい
自由度,1,マーケットでのアイテム売買が盛んでがんばればゲーム代ぐらいの金額はすぐにペイできるところだけは評価する
自由度,1,車両でヒャッハーするもよし、敵のいる家にボンバーマンするもよし
自由度,1,色々な縛りプレイも出来るため、遊び方は人それぞれ楽しめるだろう
自由度,1,自分のやり方で自由にゲームをプレイできた
自由度,1,家に籠るか、物資を求めて移動するか、攻撃を仕掛けるか、逃げ続けるか、立ち向かうのか
自由度,1,ソロでも充分に楽しめるし、ランクトップ(ドン勝)も狙える。
自由度,1,武器を集めたり好きに移動できたりと何か自由度の高い感じも楽しいです。
